2023-07-13 20:46:36.390759 IP 10.10.1.2.4242 > 10.10.1.3.4242: UDP, length 280
2023-07-13 20:46:36.391168 IP 10.10.1.3.4242 > 10.10.1.2.4242: UDP, length 84
2023-07-13 20:46:36.441543 IP 10.10.1.2.4242 > 10.10.1.3.4242: UDP, length 184
2023-07-13 20:46:36.441786 IP 10.10.1.2.4242 > 10.10.1.3.4242: UDP, length 144
2023-07-13 20:46:36.441880 IP 10.10.1.3.4242 > 10.10.1.2.4242: UDP, length 84
2023-07-13 20:46:36.441983 IP 10.10.1.3.4242 > 10.10.1.2.4242: UDP, length 84
2023-07-13 20:46:36.443814 IP 10.10.1.2.4242 > 10.10.1.3.4242: UDP, length 320
2023-07-13 20:46:36.444041 IP 10.10.1.2.4242 > 10.10.1.3.4242: UDP, length 312
2023-07-13 20:46:36.444101 IP 10.10.1.3.4242 > 10.10.1.2.4242: UDP, length 84
2023-07-13 20:46:36.444383 IP 10.10.1.3.4242 > 10.10.1.2.4242: UDP, length 84
2023-07-13 20:46:36.444669 IP 10.10.1.2.4242 > 10.10.1.3.4242: UDP, length 136
2023-07-13 20:46:36.444992 IP 10.10.1.3.4242 > 10.10.1.2.4242: UDP, length 84
2023-07-13 20:46:36.445609 IP 10.10.1.2.4242 > 10.10.1.3.4242: UDP, length 184
2023-07-13 20:46:36.445888 IP 10.10.1.3.4242 > 10.10.1.2.4242: UDP, length 84
2023-07-13 20:46:36.446162 IP 10.10.1.2.4242 > 10.10.1.3.4242: UDP, length 144
2023-07-13 20:46:36.446472 IP 10.10.1.3.4242 > 10.10.1.2.4242: UDP, length 84
2023-07-13 20:46:36.448020 IP 10.10.1.2.4242 > 10.10.1.3.4242: UDP, length 288
2023-07-13 20:46:36.448047 IP 10.10.1.2.4242 > 10.10.1.3.4242: UDP, length 280
2023-07-13 20:46:36.448283 IP 10.10.1.3.4242 > 10.10.1.2.4242: UDP, length 84
2023-07-13 20:46:36.448466 IP 10.10.1.2.4242 > 10.10.1.3.4242: UDP, length 136
2023-07-13 20:46:36.448514 IP 10.10.1.2.4242 > 10.10.1.3.4242: UDP, length 120
2023-07-13 20:46:36.448782 IP 10.10.1.3.4242 > 10.10.1.2.4242: UDP, length 84
2023-07-13 20:46:36.449629 IP 10.10.1.2.4242 > 10.10.1.3.4242: UDP, length 184
2023-07-13 20:46:36.449896 IP 10.10.1.2.4242 > 10.10.1.3.4242: UDP, length 144
2023-07-13 20:46:36.449950 IP 10.10.1.3.4242 > 10.10.1.2.4242: UDP, length 84
2023-07-13 20:46:36.450182 IP 10.10.1.3.4242 > 10.10.1.2.4242: UDP, length 84
2023-07-13 20:46:36.451855 IP 10.10.1.2.4242 > 10.10.1.3.4242: UDP, length 304
2023-07-13 20:46:36.451995 IP 10.10.1.2.4242 > 10.10.1.3.4242: UDP, length 288
2023-07-13 20:46:36.452112 IP 10.10.1.3.4242 > 10.10.1.2.4242: UDP, length 84
2023-07-13 20:46:36.452368 IP 10.10.1.3.4242 > 10.10.1.2.4242: UDP, length 84
2023-07-13 20:46:36.453230 IP 10.10.1.2.4242 > 10.10.1.3.4242: UDP, length 136
2023-07-13 20:46:36.453513 IP 10.10.1.2.4242 > 10.10.1.3.4242: UDP, length 184
2023-07-13 20:46:36.453552 IP 10.10.1.3.4242 > 10.10.1.2.4242: UDP, length 84
2023-07-13 20:46:36.453891 IP 10.10.1.3.4242 > 10.10.1.2.4242: UDP, length 84
2023-07-13 20:46:36.453970 IP 10.10.1.2.4242 > 10.10.1.3.4242: UDP, length 144
2023-07-13 20:46:36.454256 IP 10.10.1.3.4242 > 10.10.1.2.4242: UDP, length 84
2023-07-13 20:46:36.455887 IP 10.10.1.2.4242 > 10.10.1.3.4242: UDP, length 288
2023-07-13 20:46:36.455913 IP 10.10.1.2.4242 > 10.10.1.3.4242: UDP, length 280
2023-07-13 20:46:36.456257 IP 10.10.1.3.4242 > 10.10.1.2.4242: UDP, length 84
2023-07-13 20:46:36.456451 IP 10.10.1.2.4242 > 10.10.1.3.4242: UDP, length 136
2023-07-13 20:46:36.456829 IP 10.10.1.3.4242 > 10.10.1.2.4242: UDP, length 84
2023-07-13 20:46:36.461327 IP 10.10.1.2.4242 > 10.10.1.3.4242: UDP, length 184
2023-07-13 20:46:36.461572 IP 10.10.1.2.4242 > 10.10.1.3.4242: UDP, length 144
2023-07-13 20:46:36.461641 IP 10.10.1.3.4242 > 10.10.1.2.4242: UDP, length 84
2023-07-13 20:46:36.461822 IP 10.10.1.3.4242 > 10.10.1.2.4242: UDP, length 84
2023-07-13 20:46:36.463546 IP 10.10.1.2.4242 > 10.10.1.3.4242: UDP, length 208
2023-07-13 20:46:36.463635 IP 10.10.1.2.4242 > 10.10.1.3.4242: UDP, length 200
2023-07-13 20:46:36.463946 IP 10.10.1.3.4242 > 10.10.1.2.4242: UDP, length 84
2023-07-13 20:46:36.463993 IP 10.10.1.3.4242 > 10.10.1.2.4242: UDP, length 84
2023-07-13 20:46:36.464375 IP 10.10.1.2.4242 > 10.10.1.3.4242: UDP, length 136
2023-07-13 20:46:36.464692 IP 10.10.1.3.4242 > 10.10.1.2.4242: UDP, length 84
2023-07-13 20:46:36.465056 IP 10.10.1.2.4242 > 10.10.1.3.4242: UDP, length 184
2023-07-13 20:46:36.465423 IP 10.10.1.3.4242 > 10.10.1.2.4242: UDP, length 84
2023-07-13 20:46:36.465495 IP 10.10.1.2.4242 > 10.10.1.3.4242: UDP, length 144
2023-07-13 20:46:36.465845 IP 10.10.1.3.4242 > 10.10.1.2.4242: UDP, length 84
2023-07-13 20:46:36.465845 IP 10.10.1.3.4242 > 10.10.1.2.4242: UDP, length 120
2023-07-13 20:46:36.467456 IP 10.10.1.2.4242 > 10.10.1.3.4242: UDP, length 208
2023-07-13 20:46:36.467483 IP 10.10.1.2.4242 > 10.10.1.3.4242: UDP, length 200
2023-07-13 20:46:36.467754 IP 10.10.1.2.4242 > 10.10.1.3.4242: UDP, length 136
2023-07-13 20:46:36.467764 IP 10.10.1.3.4242 > 10.10.1.2.4242: UDP, length 84
2023-07-13 20:46:36.468845 IP 10.10.1.2.4242 > 10.10.1.3.4242: UDP, length 184
2023-07-13 20:46:36.469104 IP 10.10.1.3.4242 > 10.10.1.2.4242: UDP, length 84
2023-07-13 20:46:36.469160 IP 10.10.1.2.4242 > 10.10.1.3.4242: UDP, length 144
2023-07-13 20:46:36.471245 IP 10.10.1.2.4242 > 10.10.1.3.4242: UDP, length 208
2023-07-13 20:46:36.471361 IP 10.10.1.2.4242 > 10.10.1.3.4242: UDP, length 200
2023-07-13 20:46:36.471562 IP 10.10.1.3.4242 > 10.10.1.2.4242: UDP, length 84
2023-07-13 20:46:36.472094 IP 10.10.1.2.4242 > 10.10.1.3.4242: UDP, length 136
2023-07-13 20:46:36.472381 IP 10.10.1.3.4242 > 10.10.1.2.4242: UDP, length 84
2023-07-13 20:46:36.472944 IP 10.10.1.2.4242 > 10.10.1.3.4242: UDP, length 184
2023-07-13 20:46:36.473243 IP 10.10.1.2.4242 > 10.10.1.3.4242: UDP, length 144
2023-07-13 20:46:36.473615 IP 10.10.1.3.4242 > 10.10.1.2.4242: UDP, length 84
2023-07-13 20:46:36.475132 IP 10.10.1.2.4242 > 10.10.1.3.4242: UDP, length 208
2023-07-13 20:46:36.475292 IP 10.10.1.2.4242 > 10.10.1.3.4242: UDP, length 200
2023-07-13 20:46:36.475556 IP 10.10.1.3.4242 > 10.10.1.2.4242: UDP, length 84
2023-07-13 20:46:36.475998 IP 10.10.1.2.4242 > 10.10.1.3.4242: UDP, length 136
2023-07-13 20:46:36.476705 IP 10.10.1.2.4242 > 10.10.1.3.4242: UDP, length 184
2023-07-13 20:46:36.476994 IP 10.10.1.2.4242 > 10.10.1.3.4242: UDP, length 144
2023-07-13 20:46:36.477014 IP 10.10.1.3.4242 > 10.10.1.2.4242: UDP, length 84
2023-07-13 20:46:36.478951 IP 10.10.1.2.4242 > 10.10.1.3.4242: UDP, length 288
2023-07-13 20:46:36.479230 IP 10.10.1.3.4242 > 10.10.1.2.4242: UDP, length 84
2023-07-13 20:46:36.479378 IP 10.10.1.2.4242 > 10.10.1.3.4242: UDP, length 136
2023-07-13 20:46:36.480262 IP 10.10.1.2.4242 > 10.10.1.3.4242: UDP, length 184
2023-07-13 20:46:36.480528 IP 10.10.1.2.4242 > 10.10.1.3.4242: UDP, length 144
2023-07-13 20:46:36.480576 IP 10.10.1.3.4242 > 10.10.1.2.4242: UDP, length 84
2023-07-13 20:46:36.482541 IP 10.10.1.2.4242 > 10.10.1.3.4242: UDP, length 208
2023-07-13 20:46:36.482883 IP 10.10.1.2.4242 > 10.10.1.3.4242: UDP, length 200
2023-07-13 20:46:36.482896 IP 10.10.1.3.4242 > 10.10.1.2.4242: UDP, length 84
2023-07-13 20:46:36.483487 IP 10.10.1.2.4242 > 10.10.1.3.4242: UDP, length 136
2023-07-13 20:46:36.483793 IP 10.10.1.3.4242 > 10.10.1.2.4242: UDP, length 84
2023-07-13 20:46:36.484504 IP 10.10.1.2.4242 > 10.10.1.3.4242: UDP, length 184
2023-07-13 20:46:36.484705 IP 10.10.1.2.4242 > 10.10.1.3.4242: UDP, length 144
2023-07-13 20:46:36.484976 IP 10.10.1.3.4242 > 10.10.1.2.4242: UDP, length 84
2023-07-13 20:46:36.486701 IP 10.10.1.2.4242 > 10.10.1.3.4242: UDP, length 208
2023-07-13 20:46:36.486823 IP 10.10.1.2.4242 > 10.10.1.3.4242: UDP, length 200
2023-07-13 20:46:36.487030 IP 10.10.1.3.4242 > 10.10.1.2.4242: UDP, length 84
2023-07-13 20:46:36.487546 IP 10.10.1.2.4242 > 10.10.1.3.4242: UDP, length 136
2023-07-13 20:46:36.488324 IP 10.10.1.2.4242 > 10.10.1.3.4242: UDP, length 184
2023-07-13 20:46:36.488496 IP 10.10.1.3.4242 > 10.10.1.2.4242: UDP, length 84
2023-07-13 20:46:36.489032 IP 10.10.1.2.4242 > 10.10.1.3.4242: UDP, length 144
2023-07-13 20:46:36.490982 IP 10.10.1.2.4242 > 10.10.1.3.4242: UDP, length 208
2023-07-13 20:46:36.491366 IP 10.10.1.2.4242 > 10.10.1.3.4242: UDP, length 200
2023-07-13 20:46:36.491399 IP 10.10.1.3.4242 > 10.10.1.2.4242: UDP, length 84
2023-07-13 20:46:36.491858 IP 10.10.1.2.4242 > 10.10.1.3.4242: UDP, length 136
2023-07-13 20:46:36.492211 IP 10.10.1.3.4242 > 10.10.1.2.4242: UDP, length 84
2023-07-13 20:46:36.492712 IP 10.10.1.2.4242 > 10.10.1.3.4242: UDP, length 184
2023-07-13 20:46:36.493076 IP 10.10.1.2.4242 > 10.10.1.3.4242: UDP, length 144
2023-07-13 20:46:36.493349 IP 10.10.1.3.4242 > 10.10.1.2.4242: UDP, length 84
2023-07-13 20:46:36.494951 IP 10.10.1.2.4242 > 10.10.1.3.4242: UDP, length 208
2023-07-13 20:46:36.495326 IP 10.10.1.2.4242 > 10.10.1.3.4242: UDP, length 200
2023-07-13 20:46:36.495721 IP 10.10.1.3.4242 > 10.10.1.2.4242: UDP, length 84
2023-07-13 20:46:36.495872 IP 10.10.1.2.4242 > 10.10.1.3.4242: UDP, length 136
2023-07-13 20:46:36.496709 IP 10.10.1.2.4242 > 10.10.1.3.4242: UDP, length 184
2023-07-13 20:46:36.497035 IP 10.10.1.2.4242 > 10.10.1.3.4242: UDP, length 144
2023-07-13 20:46:36.497059 IP 10.10.1.3.4242 > 10.10.1.2.4242: UDP, length 84
2023-07-13 20:46:36.498973 IP 10.10.1.2.4242 > 10.10.1.3.4242: UDP, length 208
2023-07-13 20:46:36.499185 IP 10.10.1.2.4242 > 10.10.1.3.4242: UDP, length 200
2023-07-13 20:46:36.499274 IP 10.10.1.3.4242 > 10.10.1.2.4242: UDP, length 84
2023-07-13 20:46:36.499540 IP 10.10.1.2.4242 > 10.10.1.3.4242: UDP, length 136
2023-07-13 20:46:36.499794 IP 10.10.1.3.4242 > 10.10.1.2.4242: UDP, length 84
2023-07-13 20:46:36.500586 IP 10.10.1.2.4242 > 10.10.1.3.4242: UDP, length 184
2023-07-13 20:46:36.500763 IP 10.10.1.2.4242 > 10.10.1.3.4242: UDP, length 144
2023-07-13 20:46:36.501001 IP 10.10.1.3.4242 > 10.10.1.2.4242: UDP, length 84
2023-07-13 20:46:36.502747 IP 10.10.1.2.4242 > 10.10.1.3.4242: UDP, length 208
2023-07-13 20:46:36.502895 IP 10.10.1.2.4242 > 10.10.1.3.4242: UDP, length 200
2023-07-13 20:46:36.503161 IP 10.10.1.3.4242 > 10.10.1.2.4242: UDP, length 84
2023-07-13 20:46:36.503582 IP 10.10.1.2.4242 > 10.10.1.3.4242: UDP, length 136
2023-07-13 20:46:36.504522 IP 10.10.1.2.4242 > 10.10.1.3.4242: UDP, length 184
2023-07-13 20:46:36.504811 IP 10.10.1.3.4242 > 10.10.1.2.4242: UDP, length 84
2023-07-13 20:46:36.505747 IP 10.10.1.2.4242 > 10.10.1.3.4242: UDP, length 144
2023-07-13 20:46:36.507691 IP 10.10.1.2.4242 > 10.10.1.3.4242: UDP, length 208
2023-07-13 20:46:36.507901 IP 10.10.1.2.4242 > 10.10.1.3.4242: UDP, length 200
2023-07-13 20:46:36.507972 IP 10.10.1.3.4242 > 10.10.1.2.4242: UDP, length 84
2023-07-13 20:46:36.508610 IP 10.10.1.2.4242 > 10.10.1.3.4242: UDP, length 136
2023-07-13 20:46:36.508822 IP 10.10.1.3.4242 > 10.10.1.2.4242: UDP, length 84
2023-07-13 20:46:36.509746 IP 10.10.1.2.4242 > 10.10.1.3.4242: UDP, length 184
2023-07-13 20:46:36.509775 IP 10.10.1.2.4242 > 10.10.1.3.4242: UDP, length 144
2023-07-13 20:46:36.510066 IP 10.10.1.3.4242 > 10.10.1.2.4242: UDP, length 84
2023-07-13 20:46:36.512152 IP 10.10.1.2.4242 > 10.10.1.3.4242: UDP, length 288
2023-07-13 20:46:36.513415 IP 10.10.1.2.4242 > 10.10.1.3.4242: UDP, length 136
2023-07-13 20:46:36.513628 IP 10.10.1.2.4242 > 10.10.1.3.4242: UDP, length 184
2023-07-13 20:46:36.513749 IP 10.10.1.3.4242 > 10.10.1.2.4242: UDP, length 84
2023-07-13 20:46:36.514248 IP 10.10.1.2.4242 > 10.10.1.3.4242: UDP, length 144
2023-07-13 20:46:36.514507 IP 10.10.1.3.4242 > 10.10.1.2.4242: UDP, length 84
2023-07-13 20:46:36.516206 IP 10.10.1.2.4242 > 10.10.1.3.4242: UDP, length 288
2023-07-13 20:46:36.516721 IP 10.10.1.2.4242 > 10.10.1.3.4242: UDP, length 136
2023-07-13 20:46:36.517022 IP 10.10.1.3.4242 > 10.10.1.2.4242: UDP, length 84
2023-07-13 20:46:36.517646 IP 10.10.1.2.4242 > 10.10.1.3.4242: UDP, length 184
2023-07-13 20:46:36.517679 IP 10.10.1.2.4242 > 10.10.1.3.4242: UDP, length 120
2023-07-13 20:46:36.517696 IP 10.10.1.2.4242 > 10.10.1.3.4242: UDP, length 144
2023-07-13 20:46:36.517922 IP 10.10.1.3.4242 > 10.10.1.2.4242: UDP, length 84
2023-07-13 20:46:36.519711 IP 10.10.1.2.4242 > 10.10.1.3.4242: UDP, length 208
2023-07-13 20:46:36.519762 IP 10.10.1.2.4242 > 10.10.1.3.4242: UDP, length 200
2023-07-13 20:46:36.520063 IP 10.10.1.3.4242 > 10.10.1.2.4242: UDP, length 84
2023-07-13 20:46:36.520395 IP 10.10.1.2.4242 > 10.10.1.3.4242: UDP, length 136
2023-07-13 20:46:36.521155 IP 10.10.1.2.4242 > 10.10.1.3.4242: UDP, length 184
2023-07-13 20:46:36.521429 IP 10.10.1.3.4242 > 10.10.1.2.4242: UDP, length 84
2023-07-13 20:46:36.521808 IP 10.10.1.2.4242 > 10.10.1.3.4242: UDP, length 136
2023-07-13 20:46:36.521838 IP 10.10.1.2.4242 > 10.10.1.3.4242: UDP, length 120
2023-07-13 20:46:36.522067 IP 10.10.1.3.4242 > 10.10.1.2.4242: UDP, length 84
2023-07-13 20:46:36.524029 IP 10.10.1.2.4242 > 10.10.1.3.4242: UDP, length 208
2023-07-13 20:46:36.524229 IP 10.10.1.2.4242 > 10.10.1.3.4242: UDP, length 200
2023-07-13 20:46:36.524567 IP 10.10.1.3.4242 > 10.10.1.2.4242: UDP, length 84
2023-07-13 20:46:36.525120 IP 10.10.1.2.4242 > 10.10.1.3.4242: UDP, length 136
2023-07-13 20:46:36.525147 IP 10.10.1.2.4242 > 10.10.1.3.4242: UDP, length 120
2023-07-13 20:46:36.525405 IP 10.10.1.3.4242 > 10.10.1.2.4242: UDP, length 84
2023-07-13 20:46:36.526263 IP 10.10.1.2.4242 > 10.10.1.3.4242: UDP, length 184
2023-07-13 20:46:36.526298 IP 10.10.1.2.4242 > 10.10.1.3.4242: UDP, length 120
2023-07-13 20:46:36.526345 IP 10.10.1.2.4242 > 10.10.1.3.4242: UDP, length 144
2023-07-13 20:46:36.526607 IP 10.10.1.3.4242 > 10.10.1.2.4242: UDP, length 84
2023-07-13 20:46:36.528383 IP 10.10.1.2.4242 > 10.10.1.3.4242: UDP, length 288
2023-07-13 20:46:36.528861 IP 10.10.1.2.4242 > 10.10.1.3.4242: UDP, length 136
2023-07-13 20:46:36.529211 IP 10.10.1.3.4242 > 10.10.1.2.4242: UDP, length 84
2023-07-13 20:46:36.529579 IP 10.10.1.2.4242 > 10.10.1.3.4242: UDP, length 120
2023-07-13 20:46:36.530098 IP 10.10.1.2.4242 > 10.10.1.3.4242: UDP, length 184
2023-07-13 20:46:36.530125 IP 10.10.1.2.4242 > 10.10.1.3.4242: UDP, length 120
2023-07-13 20:46:36.530154 IP 10.10.1.2.4242 > 10.10.1.3.4242: UDP, length 144
2023-07-13 20:46:36.530374 IP 10.10.1.3.4242 > 10.10.1.2.4242: UDP, length 84
2023-07-13 20:46:36.532279 IP 10.10.1.2.4242 > 10.10.1.3.4242: UDP, length 208
2023-07-13 20:46:36.532309 IP 10.10.1.2.4242 > 10.10.1.3.4242: UDP, length 200
2023-07-13 20:46:36.532586 IP 10.10.1.3.4242 > 10.10.1.2.4242: UDP, length 84
2023-07-13 20:46:36.532940 IP 10.10.1.2.4242 > 10.10.1.3.4242: UDP, length 136
2023-07-13 20:46:36.533579 IP 10.10.1.2.4242 > 10.10.1.3.4242: UDP, length 120
2023-07-13 20:46:36.533772 IP 10.10.1.2.4242 > 10.10.1.3.4242: UDP, length 184
2023-07-13 20:46:36.533866 IP 10.10.1.3.4242 > 10.10.1.2.4242: UDP, length 84
2023-07-13 20:46:36.534527 IP 10.10.1.2.4242 > 10.10.1.3.4242: UDP, length 136
2023-07-13 20:46:36.534559 IP 10.10.1.2.4242 > 10.10.1.3.4242: UDP, length 120
2023-07-13 20:46:36.534764 IP 10.10.1.3.4242 > 10.10.1.2.4242: UDP, length 84
2023-07-13 20:46:36.536785 IP 10.10.1.2.4242 > 10.10.1.3.4242: UDP, length 208
2023-07-13 20:46:36.536818 IP 10.10.1.2.4242 > 10.10.1.3.4242: UDP, length 120
2023-07-13 20:46:36.537059 IP 10.10.1.3.4242 > 10.10.1.2.4242: UDP, length 84
2023-07-13 20:46:36.537236 IP 10.10.1.2.4242 > 10.10.1.3.4242: UDP, length 200
2023-07-13 20:46:36.537270 IP 10.10.1.2.4242 > 10.10.1.3.4242: UDP, length 120
2023-07-13 20:46:36.537478 IP 10.10.1.3.4242 > 10.10.1.2.4242: UDP, length 84
2023-07-13 20:46:36.537858 IP 10.10.1.2.4242 > 10.10.1.3.4242: UDP, length 136
2023-07-13 20:46:36.537877 IP 10.10.1.2.4242 > 10.10.1.3.4242: UDP, length 120
2023-07-13 20:46:36.538103 IP 10.10.1.3.4242 > 10.10.1.2.4242: UDP, length 84
2023-07-13 20:46:36.539023 IP 10.10.1.2.4242 > 10.10.1.3.4242: UDP, length 184
2023-07-13 20:46:36.539282 IP 10.10.1.2.4242 > 10.10.1.3.4242: UDP, length 136
2023-07-13 20:46:36.539302 IP 10.10.1.2.4242 > 10.10.1.3.4242: UDP, length 120
2023-07-13 20:46:36.539499 IP 10.10.1.3.4242 > 10.10.1.2.4242: UDP, length 84
2023-07-13 20:46:36.541656 IP 10.10.1.2.4242 > 10.10.1.3.4242: UDP, length 208
2023-07-13 20:46:36.541690 IP 10.10.1.2.4242 > 10.10.1.3.4242: UDP, length 120
2023-07-13 20:46:36.541917 IP 10.10.1.2.4242 > 10.10.1.3.4242: UDP, length 200
2023-07-13 20:46:36.542017 IP 10.10.1.3.4242 > 10.10.1.2.4242: UDP, length 84
2023-07-13 20:46:36.542428 IP 10.10.1.2.4242 > 10.10.1.3.4242: UDP, length 136
2023-07-13 20:46:36.542450 IP 10.10.1.2.4242 > 10.10.1.3.4242: UDP, length 120
2023-07-13 20:46:36.542736 IP 10.10.1.3.4242 > 10.10.1.2.4242: UDP, length 84
2023-07-13 20:46:36.543589 IP 10.10.1.2.4242 > 10.10.1.3.4242: UDP, length 184
2023-07-13 20:46:36.543910 IP 10.10.1.2.4242 > 10.10.1.3.4242: UDP, length 136
2023-07-13 20:46:36.543934 IP 10.10.1.2.4242 > 10.10.1.3.4242: UDP, length 120
2023-07-13 20:46:36.544158 IP 10.10.1.3.4242 > 10.10.1.2.4242: UDP, length 84
2023-07-13 20:46:36.546149 IP 10.10.1.2.4242 > 10.10.1.3.4242: UDP, length 208
2023-07-13 20:46:36.546180 IP 10.10.1.2.4242 > 10.10.1.3.4242: UDP, length 120
2023-07-13 20:46:36.546352 IP 10.10.1.2.4242 > 10.10.1.3.4242: UDP, length 200
2023-07-13 20:46:36.546414 IP 10.10.1.2.4242 > 10.10.1.3.4242: UDP, length 120
2023-07-13 20:46:36.546523 IP 10.10.1.3.4242 > 10.10.1.2.4242: UDP, length 84
2023-07-13 20:46:36.546641 IP 10.10.1.3.4242 > 10.10.1.2.4242: UDP, length 84
2023-07-13 20:46:36.547334 IP 10.10.1.2.4242 > 10.10.1.3.4242: UDP, length 136
2023-07-13 20:46:36.547369 IP 10.10.1.2.4242 > 10.10.1.3.4242: UDP, length 184
2023-07-13 20:46:36.547578 IP 10.10.1.3.4242 > 10.10.1.2.4242: UDP, length 84
2023-07-13 20:46:36.548307 IP 10.10.1.2.4242 > 10.10.1.3.4242: UDP, length 144
2023-07-13 20:46:36.548342 IP 10.10.1.2.4242 > 10.10.1.3.4242: UDP, length 184
2023-07-13 20:46:36.548595 IP 10.10.1.3.4242 > 10.10.1.2.4242: UDP, length 84
2023-07-13 20:46:36.548873 IP 10.10.1.2.4242 > 10.10.1.3.4242: UDP, length 136
2023-07-13 20:46:36.548901 IP 10.10.1.2.4242 > 10.10.1.3.4242: UDP, length 120
2023-07-13 20:46:36.549201 IP 10.10.1.3.4242 > 10.10.1.2.4242: UDP, length 84
2023-07-13 20:46:36.550624 IP 10.10.1.2.4242 > 10.10.1.3.4242: UDP, length 304
2023-07-13 20:46:36.550656 IP 10.10.1.2.4242 > 10.10.1.3.4242: UDP, length 288
2023-07-13 20:46:36.550942 IP 10.10.1.3.4242 > 10.10.1.2.4242: UDP, length 84
2023-07-13 20:46:36.551412 IP 10.10.1.2.4242 > 10.10.1.3.4242: UDP, length 136
2023-07-13 20:46:36.552383 IP 10.10.1.2.4242 > 10.10.1.3.4242: UDP, length 352
2023-07-13 20:46:36.552618 IP 10.10.1.3.4242 > 10.10.1.2.4242: UDP, length 84
2023-07-13 20:46:36.555616 IP 10.10.1.2.4242 > 10.10.1.3.4242: UDP, length 592
2023-07-13 20:46:36.556351 IP 10.10.1.2.4242 > 10.10.1.3.4242: UDP, length 184
2023-07-13 20:46:36.556574 IP 10.10.1.3.4242 > 10.10.1.2.4242: UDP, length 84
2023-07-13 20:46:36.556988 IP 10.10.1.2.4242 > 10.10.1.3.4242: UDP, length 144
2023-07-13 20:46:36.557448 IP 10.10.1.2.4242 > 10.10.1.3.4242: UDP, length 208
2023-07-13 20:46:36.557626 IP 10.10.1.3.4242 > 10.10.1.2.4242: UDP, length 84
2023-07-13 20:46:36.558721 IP 10.10.1.2.4242 > 10.10.1.3.4242: UDP, length 216
2023-07-13 20:46:36.559016 IP 10.10.1.2.4242 > 10.10.1.3.4242: UDP, length 448
2023-07-13 20:46:36.559043 IP 10.10.1.2.4242 > 10.10.1.3.4242: UDP, length 184
2023-07-13 20:46:36.559269 IP 10.10.1.3.4242 > 10.10.1.2.4242: UDP, length 84
2023-07-13 20:46:36.559299 IP 10.10.1.2.4242 > 10.10.1.3.4242: UDP, length 144
2023-07-13 20:46:36.559795 IP 10.10.1.2.4242 > 10.10.1.3.4242: UDP, length 136
2023-07-13 20:46:36.560003 IP 10.10.1.3.4242 > 10.10.1.2.4242: UDP, length 84
2023-07-13 20:46:36.560802 IP 10.10.1.2.4242 > 10.10.1.3.4242: UDP, length 184
2023-07-13 20:46:36.562092 IP 10.10.1.2.4242 > 10.10.1.3.4242: UDP, length 208
2023-07-13 20:46:36.562300 IP 10.10.1.3.4242 > 10.10.1.2.4242: UDP, length 84
2023-07-13 20:46:36.562369 IP 10.10.1.2.4242 > 10.10.1.3.4242: UDP, length 200
2023-07-13 20:46:36.563327 IP 10.10.1.2.4242 > 10.10.1.3.4242: UDP, length 144
2023-07-13 20:46:36.563358 IP 10.10.1.2.4242 > 10.10.1.3.4242: UDP, length 136
2023-07-13 20:46:36.563569 IP 10.10.1.3.4242 > 10.10.1.2.4242: UDP, length 84
2023-07-13 20:46:36.563968 IP 10.10.1.2.4242 > 10.10.1.3.4242: UDP, length 184
2023-07-13 20:46:36.564152 IP 10.10.1.2.4242 > 10.10.1.3.4242: UDP, length 144
2023-07-13 20:46:36.564154 IP 10.10.1.3.4242 > 10.10.1.2.4242: UDP, length 84
2023-07-13 20:46:36.564382 IP 10.10.1.2.4242 > 10.10.1.3.4242: UDP, length 288
2023-07-13 20:46:36.564559 IP 10.10.1.3.4242 > 10.10.1.2.4242: UDP, length 84
2023-07-13 20:46:36.564822 IP 10.10.1.2.4242 > 10.10.1.3.4242: UDP, length 280
2023-07-13 20:46:36.565028 IP 10.10.1.2.4242 > 10.10.1.3.4242: UDP, length 136
2023-07-13 20:46:36.565229 IP 10.10.1.3.4242 > 10.10.1.2.4242: UDP, length 84
2023-07-13 20:46:36.566014 IP 10.10.1.2.4242 > 10.10.1.3.4242: UDP, length 184
2023-07-13 20:46:36.566985 IP 10.10.1.2.4242 > 10.10.1.3.4242: UDP, length 208
2023-07-13 20:46:36.567183 IP 10.10.1.3.4242 > 10.10.1.2.4242: UDP, length 84
2023-07-13 20:46:36.567293 IP 10.10.1.2.4242 > 10.10.1.3.4242: UDP, length 200
2023-07-13 20:46:36.568083 IP 10.10.1.2.4242 > 10.10.1.3.4242: UDP, length 136
2023-07-13 20:46:36.568262 IP 10.10.1.3.4242 > 10.10.1.2.4242: UDP, length 84
2023-07-13 20:46:36.568429 IP 10.10.1.2.4242 > 10.10.1.3.4242: UDP, length 144
2023-07-13 20:46:36.568677 IP 10.10.1.2.4242 > 10.10.1.3.4242: UDP, length 184
2023-07-13 20:46:36.568799 IP 10.10.1.2.4242 > 10.10.1.3.4242: UDP, length 144
2023-07-13 20:46:36.568839 IP 10.10.1.3.4242 > 10.10.1.2.4242: UDP, length 84
2023-07-13 20:46:36.570573 IP 10.10.1.2.4242 > 10.10.1.3.4242: UDP, length 304
2023-07-13 20:46:36.570656 IP 10.10.1.2.4242 > 10.10.1.3.4242: UDP, length 376
2023-07-13 20:46:36.570864 IP 10.10.1.3.4242 > 10.10.1.2.4242: UDP, length 84
2023-07-13 20:46:36.570956 IP 10.10.1.2.4242 > 10.10.1.3.4242: UDP, length 200
2023-07-13 20:46:36.571160 IP 10.10.1.3.4242 > 10.10.1.2.4242: UDP, length 84
2023-07-13 20:46:36.571988 IP 10.10.1.2.4242 > 10.10.1.3.4242: UDP, length 144
2023-07-13 20:46:36.572654 IP 10.10.1.2.4242 > 10.10.1.3.4242: UDP, length 184
2023-07-13 20:46:36.572680 IP 10.10.1.2.4242 > 10.10.1.3.4242: UDP, length 144
2023-07-13 20:46:36.572852 IP 10.10.1.3.4242 > 10.10.1.2.4242: UDP, length 84
2023-07-13 20:46:36.573131 IP 10.10.1.2.4242 > 10.10.1.3.4242: UDP, length 184
2023-07-13 20:46:36.573740 IP 10.10.1.2.4242 > 10.10.1.3.4242: UDP, length 144
2023-07-13 20:46:36.573986 IP 10.10.1.3.4242 > 10.10.1.2.4242: UDP, length 84
2023-07-13 20:46:36.574697 IP 10.10.1.2.4242 > 10.10.1.3.4242: UDP, length 208
2023-07-13 20:46:36.574726 IP 10.10.1.2.4242 > 10.10.1.3.4242: UDP, length 200
2023-07-13 20:46:36.574973 IP 10.10.1.3.4242 > 10.10.1.2.4242: UDP, length 84
2023-07-13 20:46:36.575501 IP 10.10.1.2.4242 > 10.10.1.3.4242: UDP, length 136
2023-07-13 20:46:36.576250 IP 10.10.1.2.4242 > 10.10.1.3.4242: UDP, length 304
2023-07-13 20:46:36.576486 IP 10.10.1.2.4242 > 10.10.1.3.4242: UDP, length 312
2023-07-13 20:46:36.576498 IP 10.10.1.3.4242 > 10.10.1.2.4242: UDP, length 84
2023-07-13 20:46:36.576855 IP 10.10.1.2.4242 > 10.10.1.3.4242: UDP, length 184
2023-07-13 20:46:36.577082 IP 10.10.1.3.4242 > 10.10.1.2.4242: UDP, length 84
2023-07-13 20:46:36.577301 IP 10.10.1.2.4242 > 10.10.1.3.4242: UDP, length 136
2023-07-13 20:46:36.578249 IP 10.10.1.2.4242 > 10.10.1.3.4242: UDP, length 184
2023-07-13 20:46:36.578478 IP 10.10.1.3.4242 > 10.10.1.2.4242: UDP, length 84
2023-07-13 20:46:36.579054 IP 10.10.1.2.4242 > 10.10.1.3.4242: UDP, length 232
2023-07-13 20:46:36.579477 IP 10.10.1.2.4242 > 10.10.1.3.4242: UDP, length 200
2023-07-13 20:46:36.579673 IP 10.10.1.3.4242 > 10.10.1.2.4242: UDP, length 84
2023-07-13 20:46:36.579812 IP 10.10.1.2.4242 > 10.10.1.3.4242: UDP, length 136
2023-07-13 20:46:36.580839 IP 10.10.1.2.4242 > 10.10.1.3.4242: UDP, length 184
2023-07-13 20:46:36.581040 IP 10.10.1.3.4242 > 10.10.1.2.4242: UDP, length 84
2023-07-13 20:46:36.581468 IP 10.10.1.2.4242 > 10.10.1.3.4242: UDP, length 144
2023-07-13 20:46:36.582486 IP 10.10.1.2.4242 > 10.10.1.3.4242: UDP, length 448
2023-07-13 20:46:36.582811 IP 10.10.1.3.4242 > 10.10.1.2.4242: UDP, length 84
2023-07-13 20:46:36.582941 IP 10.10.1.2.4242 > 10.10.1.3.4242: UDP, length 136
2023-07-13 20:46:36.583450 IP 10.10.1.2.4242 > 10.10.1.3.4242: UDP, length 208
2023-07-13 20:46:36.583656 IP 10.10.1.2.4242 > 10.10.1.3.4242: UDP, length 200
2023-07-13 20:46:36.583732 IP 10.10.1.2.4242 > 10.10.1.3.4242: UDP, length 184
2023-07-13 20:46:36.583730 IP 10.10.1.3.4242 > 10.10.1.2.4242: UDP, length 84
2023-07-13 20:46:36.583917 IP 10.10.1.3.4242 > 10.10.1.2.4242: UDP, length 84
2023-07-13 20:46:36.584351 IP 10.10.1.2.4242 > 10.10.1.3.4242: UDP, length 136
2023-07-13 20:46:36.585121 IP 10.10.1.2.4242 > 10.10.1.3.4242: UDP, length 184
2023-07-13 20:46:36.585394 IP 10.10.1.3.4242 > 10.10.1.2.4242: UDP, length 84
2023-07-13 20:46:36.585467 IP 10.10.1.2.4242 > 10.10.1.3.4242: UDP, length 144
2023-07-13 20:46:36.585624 IP 10.10.1.2.4242 > 10.10.1.3.4242: UDP, length 144
2023-07-13 20:46:36.585829 IP 10.10.1.3.4242 > 10.10.1.2.4242: UDP, length 84
2023-07-13 20:46:36.587581 IP 10.10.1.2.4242 > 10.10.1.3.4242: UDP, length 376
2023-07-13 20:46:36.587726 IP 10.10.1.2.4242 > 10.10.1.3.4242: UDP, length 200
2023-07-13 20:46:36.587896 IP 10.10.1.2.4242 > 10.10.1.3.4242: UDP, length 280
2023-07-13 20:46:36.587939 IP 10.10.1.3.4242 > 10.10.1.2.4242: UDP, length 84
2023-07-13 20:46:36.589052 IP 10.10.1.2.4242 > 10.10.1.3.4242: UDP, length 144
2023-07-13 20:46:36.589163 IP 10.10.1.2.4242 > 10.10.1.3.4242: UDP, length 184
2023-07-13 20:46:36.589257 IP 10.10.1.3.4242 > 10.10.1.2.4242: UDP, length 84
2023-07-13 20:46:36.589284 IP 10.10.1.2.4242 > 10.10.1.3.4242: UDP, length 144
2023-07-13 20:46:36.589495 IP 10.10.1.3.4242 > 10.10.1.2.4242: UDP, length 84
2023-07-13 20:46:36.589778 IP 10.10.1.2.4242 > 10.10.1.3.4242: UDP, length 208
2023-07-13 20:46:36.591380 IP 10.10.1.2.4242 > 10.10.1.3.4242: UDP, length 288
2023-07-13 20:46:36.591612 IP 10.10.1.3.4242 > 10.10.1.2.4242: UDP, length 84
2023-07-13 20:46:36.591630 IP 10.10.1.2.4242 > 10.10.1.3.4242: UDP, length 472
2023-07-13 20:46:36.591924 IP 10.10.1.2.4242 > 10.10.1.3.4242: UDP, length 136
2023-07-13 20:46:36.592140 IP 10.10.1.3.4242 > 10.10.1.2.4242: UDP, length 84
2023-07-13 20:46:36.592546 IP 10.10.1.2.4242 > 10.10.1.3.4242: UDP, length 136
2023-07-13 20:46:36.592911 IP 10.10.1.2.4242 > 10.10.1.3.4242: UDP, length 184
2023-07-13 20:46:36.593129 IP 10.10.1.3.4242 > 10.10.1.2.4242: UDP, length 84
2023-07-13 20:46:36.593508 IP 10.10.1.2.4242 > 10.10.1.3.4242: UDP, length 184
2023-07-13 20:46:36.593612 IP 10.10.1.2.4242 > 10.10.1.3.4242: UDP, length 144
2023-07-13 20:46:36.593812 IP 10.10.1.3.4242 > 10.10.1.2.4242: UDP, length 84
2023-07-13 20:46:36.594485 IP 10.10.1.2.4242 > 10.10.1.3.4242: UDP, length 144
2023-07-13 20:46:36.595764 IP 10.10.1.2.4242 > 10.10.1.3.4242: UDP, length 208
2023-07-13 20:46:36.595805 IP 10.10.1.2.4242 > 10.10.1.3.4242: UDP, length 200
2023-07-13 20:46:36.595989 IP 10.10.1.3.4242 > 10.10.1.2.4242: UDP, length 84
2023-07-13 20:46:36.596358 IP 10.10.1.2.4242 > 10.10.1.3.4242: UDP, length 136
2023-07-13 20:46:36.596602 IP 10.10.1.3.4242 > 10.10.1.2.4242: UDP, length 84
2023-07-13 20:46:36.596672 IP 10.10.1.2.4242 > 10.10.1.3.4242: UDP, length 288
2023-07-13 20:46:36.597154 IP 10.10.1.2.4242 > 10.10.1.3.4242: UDP, length 280
2023-07-13 20:46:36.597391 IP 10.10.1.3.4242 > 10.10.1.2.4242: UDP, length 84
2023-07-13 20:46:36.597475 IP 10.10.1.2.4242 > 10.10.1.3.4242: UDP, length 192
2023-07-13 20:46:36.597653 IP 10.10.1.2.4242 > 10.10.1.3.4242: UDP, length 120
2023-07-13 20:46:36.597731 IP 10.10.1.2.4242 > 10.10.1.3.4242: UDP, length 144
2023-07-13 20:46:36.597906 IP 10.10.1.3.4242 > 10.10.1.2.4242: UDP, length 84
2023-07-13 20:46:36.598572 IP 10.10.1.2.4242 > 10.10.1.3.4242: UDP, length 184
2023-07-13 20:46:36.599898 IP 10.10.1.2.4242 > 10.10.1.3.4242: UDP, length 208
2023-07-13 20:46:36.599925 IP 10.10.1.2.4242 > 10.10.1.3.4242: UDP, length 144
2023-07-13 20:46:36.600089 IP 10.10.1.2.4242 > 10.10.1.3.4242: UDP, length 200
2023-07-13 20:46:36.600104 IP 10.10.1.3.4242 > 10.10.1.2.4242: UDP, length 84
2023-07-13 20:46:36.600744 IP 10.10.1.2.4242 > 10.10.1.3.4242: UDP, length 136
2023-07-13 20:46:36.600986 IP 10.10.1.3.4242 > 10.10.1.2.4242: UDP, length 84
2023-07-13 20:46:36.601525 IP 10.10.1.2.4242 > 10.10.1.3.4242: UDP, length 184
2023-07-13 20:46:36.601840 IP 10.10.1.2.4242 > 10.10.1.3.4242: UDP, length 144
2023-07-13 20:46:36.602063 IP 10.10.1.3.4242 > 10.10.1.2.4242: UDP, length 84
2023-07-13 20:46:36.602488 IP 10.10.1.2.4242 > 10.10.1.3.4242: UDP, length 304
2023-07-13 20:46:36.602515 IP 10.10.1.2.4242 > 10.10.1.3.4242: UDP, length 296
2023-07-13 20:46:36.602721 IP 10.10.1.3.4242 > 10.10.1.2.4242: UDP, length 84
2023-07-13 20:46:36.603516 IP 10.10.1.2.4242 > 10.10.1.3.4242: UDP, length 136
2023-07-13 20:46:36.603706 IP 10.10.1.2.4242 > 10.10.1.3.4242: UDP, length 208
2023-07-13 20:46:36.603912 IP 10.10.1.3.4242 > 10.10.1.2.4242: UDP, length 84
2023-07-13 20:46:36.604173 IP 10.10.1.2.4242 > 10.10.1.3.4242: UDP, length 200
2023-07-13 20:46:36.604365 IP 10.10.1.2.4242 > 10.10.1.3.4242: UDP, length 184
2023-07-13 20:46:36.604438 IP 10.10.1.2.4242 > 10.10.1.3.4242: UDP, length 136
2023-07-13 20:46:36.604601 IP 10.10.1.3.4242 > 10.10.1.2.4242: UDP, length 84
2023-07-13 20:46:36.605327 IP 10.10.1.2.4242 > 10.10.1.3.4242: UDP, length 144
2023-07-13 20:46:36.605355 IP 10.10.1.2.4242 > 10.10.1.3.4242: UDP, length 184
2023-07-13 20:46:36.605528 IP 10.10.1.3.4242 > 10.10.1.2.4242: UDP, length 84
2023-07-13 20:46:36.606052 IP 10.10.1.2.4242 > 10.10.1.3.4242: UDP, length 136
2023-07-13 20:46:36.606079 IP 10.10.1.2.4242 > 10.10.1.3.4242: UDP, length 120
2023-07-13 20:46:36.606288 IP 10.10.1.3.4242 > 10.10.1.2.4242: UDP, length 84
2023-07-13 20:46:36.607460 IP 10.10.1.2.4242 > 10.10.1.3.4242: UDP, length 288
2023-07-13 20:46:36.607488 IP 10.10.1.2.4242 > 10.10.1.3.4242: UDP, length 280
2023-07-13 20:46:36.607645 IP 10.10.1.3.4242 > 10.10.1.2.4242: UDP, length 84
2023-07-13 20:46:36.608138 IP 10.10.1.2.4242 > 10.10.1.3.4242: UDP, length 136
2023-07-13 20:46:36.608446 IP 10.10.1.2.4242 > 10.10.1.3.4242: UDP, length 208
2023-07-13 20:46:36.608646 IP 10.10.1.3.4242 > 10.10.1.2.4242: UDP, length 84
2023-07-13 20:46:36.608939 IP 10.10.1.2.4242 > 10.10.1.3.4242: UDP, length 200
2023-07-13 20:46:36.609048 IP 10.10.1.2.4242 > 10.10.1.3.4242: UDP, length 184
2023-07-13 20:46:36.609211 IP 10.10.1.3.4242 > 10.10.1.2.4242: UDP, length 84
2023-07-13 20:46:36.609413 IP 10.10.1.2.4242 > 10.10.1.3.4242: UDP, length 136
2023-07-13 20:46:36.609864 IP 10.10.1.2.4242 > 10.10.1.3.4242: UDP, length 144
2023-07-13 20:46:36.610120 IP 10.10.1.3.4242 > 10.10.1.2.4242: UDP, length 84
2023-07-13 20:46:36.610446 IP 10.10.1.2.4242 > 10.10.1.3.4242: UDP, length 184
2023-07-13 20:46:36.611370 IP 10.10.1.2.4242 > 10.10.1.3.4242: UDP, length 144
2023-07-13 20:46:36.611682 IP 10.10.1.3.4242 > 10.10.1.2.4242: UDP, length 84
2023-07-13 20:46:36.612480 IP 10.10.1.2.4242 > 10.10.1.3.4242: UDP, length 304
2023-07-13 20:46:36.612561 IP 10.10.1.2.4242 > 10.10.1.3.4242: UDP, length 296
2023-07-13 20:46:36.612865 IP 10.10.1.3.4242 > 10.10.1.2.4242: UDP, length 84
2023-07-13 20:46:36.613033 IP 10.10.1.2.4242 > 10.10.1.3.4242: UDP, length 208
2023-07-13 20:46:36.613263 IP 10.10.1.2.4242 > 10.10.1.3.4242: UDP, length 136
2023-07-13 20:46:36.613451 IP 10.10.1.2.4242 > 10.10.1.3.4242: UDP, length 200
2023-07-13 20:46:36.613493 IP 10.10.1.3.4242 > 10.10.1.2.4242: UDP, length 84
2023-07-13 20:46:36.613763 IP 10.10.1.2.4242 > 10.10.1.3.4242: UDP, length 136
2023-07-13 20:46:36.614064 IP 10.10.1.3.4242 > 10.10.1.2.4242: UDP, length 84
2023-07-13 20:46:36.614276 IP 10.10.1.2.4242 > 10.10.1.3.4242: UDP, length 184
2023-07-13 20:46:36.614746 IP 10.10.1.2.4242 > 10.10.1.3.4242: UDP, length 184
2023-07-13 20:46:36.615003 IP 10.10.1.3.4242 > 10.10.1.2.4242: UDP, length 84
2023-07-13 20:46:36.615614 IP 10.10.1.2.4242 > 10.10.1.3.4242: UDP, length 144
2023-07-13 20:46:36.615909 IP 10.10.1.2.4242 > 10.10.1.3.4242: UDP, length 144
2023-07-13 20:46:36.616162 IP 10.10.1.3.4242 > 10.10.1.2.4242: UDP, length 84
2023-07-13 20:46:36.617920 IP 10.10.1.2.4242 > 10.10.1.3.4242: UDP, length 288
2023-07-13 20:46:36.618454 IP 10.10.1.2.4242 > 10.10.1.3.4242: UDP, length 448
2023-07-13 20:46:36.618539 IP 10.10.1.2.4242 > 10.10.1.3.4242: UDP, length 136
2023-07-13 20:46:36.618819 IP 10.10.1.3.4242 > 10.10.1.2.4242: UDP, length 84
2023-07-13 20:46:36.619358 IP 10.10.1.2.4242 > 10.10.1.3.4242: UDP, length 136
2023-07-13 20:46:36.619672 IP 10.10.1.3.4242 > 10.10.1.2.4242: UDP, length 84
2023-07-13 20:46:36.619865 IP 10.10.1.2.4242 > 10.10.1.3.4242: UDP, length 184
2023-07-13 20:46:36.620420 IP 10.10.1.2.4242 > 10.10.1.3.4242: UDP, length 184
2023-07-13 20:46:36.620527 IP 10.10.1.2.4242 > 10.10.1.3.4242: UDP, length 144
2023-07-13 20:46:36.620595 IP 10.10.1.2.4242 > 10.10.1.3.4242: UDP, length 144
2023-07-13 20:46:36.620658 IP 10.10.1.3.4242 > 10.10.1.2.4242: UDP, length 84
2023-07-13 20:46:36.620847 IP 10.10.1.3.4242 > 10.10.1.2.4242: UDP, length 84
2023-07-13 20:46:36.622677 IP 10.10.1.2.4242 > 10.10.1.3.4242: UDP, length 392
2023-07-13 20:46:36.622793 IP 10.10.1.2.4242 > 10.10.1.3.4242: UDP, length 296
2023-07-13 20:46:36.622854 IP 10.10.1.2.4242 > 10.10.1.3.4242: UDP, length 200
2023-07-13 20:46:36.623039 IP 10.10.1.3.4242 > 10.10.1.2.4242: UDP, length 84
2023-07-13 20:46:36.623253 IP 10.10.1.2.4242 > 10.10.1.3.4242: UDP, length 136
2023-07-13 20:46:36.623330 IP 10.10.1.2.4242 > 10.10.1.3.4242: UDP, length 136
2023-07-13 20:46:36.623497 IP 10.10.1.3.4242 > 10.10.1.2.4242: UDP, length 84
2023-07-13 20:46:36.624379 IP 10.10.1.2.4242 > 10.10.1.3.4242: UDP, length 184
2023-07-13 20:46:36.624550 IP 10.10.1.2.4242 > 10.10.1.3.4242: UDP, length 144
2023-07-13 20:46:36.624592 IP 10.10.1.3.4242 > 10.10.1.2.4242: UDP, length 84
2023-07-13 20:46:36.625047 IP 10.10.1.2.4242 > 10.10.1.3.4242: UDP, length 184
2023-07-13 20:46:36.625248 IP 10.10.1.3.4242 > 10.10.1.2.4242: UDP, length 84
2023-07-13 20:46:36.626622 IP 10.10.1.2.4242 > 10.10.1.3.4242: UDP, length 304
2023-07-13 20:46:36.626696 IP 10.10.1.2.4242 > 10.10.1.3.4242: UDP, length 296
2023-07-13 20:46:36.626959 IP 10.10.1.3.4242 > 10.10.1.2.4242: UDP, length 84
2023-07-13 20:46:36.627536 IP 10.10.1.2.4242 > 10.10.1.3.4242: UDP, length 144
2023-07-13 20:46:36.627624 IP 10.10.1.2.4242 > 10.10.1.3.4242: UDP, length 136
2023-07-13 20:46:36.627873 IP 10.10.1.3.4242 > 10.10.1.2.4242: UDP, length 84
2023-07-13 20:46:36.628671 IP 10.10.1.2.4242 > 10.10.1.3.4242: UDP, length 184
2023-07-13 20:46:36.628836 IP 10.10.1.2.4242 > 10.10.1.3.4242: UDP, length 144
2023-07-13 20:46:36.629076 IP 10.10.1.3.4242 > 10.10.1.2.4242: UDP, length 84
2023-07-13 20:46:36.629916 IP 10.10.1.2.4242 > 10.10.1.3.4242: UDP, length 208
2023-07-13 20:46:36.630200 IP 10.10.1.2.4242 > 10.10.1.3.4242: UDP, length 200
2023-07-13 20:46:36.630405 IP 10.10.1.3.4242 > 10.10.1.2.4242: UDP, length 84
2023-07-13 20:46:36.630470 IP 10.10.1.2.4242 > 10.10.1.3.4242: UDP, length 136
2023-07-13 20:46:36.631433 IP 10.10.1.2.4242 > 10.10.1.3.4242: UDP, length 184
2023-07-13 20:46:36.631529 IP 10.10.1.2.4242 > 10.10.1.3.4242: UDP, length 304
2023-07-13 20:46:36.631690 IP 10.10.1.3.4242 > 10.10.1.2.4242: UDP, length 84
2023-07-13 20:46:36.631736 IP 10.10.1.2.4242 > 10.10.1.3.4242: UDP, length 296
2023-07-13 20:46:36.631940 IP 10.10.1.3.4242 > 10.10.1.2.4242: UDP, length 84
2023-07-13 20:46:36.632237 IP 10.10.1.2.4242 > 10.10.1.3.4242: UDP, length 136
2023-07-13 20:46:36.632529 IP 10.10.1.2.4242 > 10.10.1.3.4242: UDP, length 144
2023-07-13 20:46:36.632771 IP 10.10.1.3.4242 > 10.10.1.2.4242: UDP, length 84
2023-07-13 20:46:36.633328 IP 10.10.1.2.4242 > 10.10.1.3.4242: UDP, length 184
2023-07-13 20:46:36.633732 IP 10.10.1.2.4242 > 10.10.1.3.4242: UDP, length 144
2023-07-13 20:46:36.633993 IP 10.10.1.3.4242 > 10.10.1.2.4242: UDP, length 84
2023-07-13 20:46:36.635581 IP 10.10.1.2.4242 > 10.10.1.3.4242: UDP, length 208
2023-07-13 20:46:36.635659 IP 10.10.1.2.4242 > 10.10.1.3.4242: UDP, length 288
2023-07-13 20:46:36.635924 IP 10.10.1.2.4242 > 10.10.1.3.4242: UDP, length 360
2023-07-13 20:46:36.635937 IP 10.10.1.3.4242 > 10.10.1.2.4242: UDP, length 84
2023-07-13 20:46:36.636449 IP 10.10.1.2.4242 > 10.10.1.3.4242: UDP, length 136
2023-07-13 20:46:36.636695 IP 10.10.1.3.4242 > 10.10.1.2.4242: UDP, length 84
2023-07-13 20:46:36.637208 IP 10.10.1.2.4242 > 10.10.1.3.4242: UDP, length 136
2023-07-13 20:46:36.637413 IP 10.10.1.2.4242 > 10.10.1.3.4242: UDP, length 184
2023-07-13 20:46:36.637621 IP 10.10.1.3.4242 > 10.10.1.2.4242: UDP, length 84
2023-07-13 20:46:36.637660 IP 10.10.1.2.4242 > 10.10.1.3.4242: UDP, length 144
2023-07-13 20:46:36.638400 IP 10.10.1.2.4242 > 10.10.1.3.4242: UDP, length 184
2023-07-13 20:46:36.638428 IP 10.10.1.2.4242 > 10.10.1.3.4242: UDP, length 144
2023-07-13 20:46:36.638663 IP 10.10.1.3.4242 > 10.10.1.2.4242: UDP, length 84
2023-07-13 20:46:36.640044 IP 10.10.1.2.4242 > 10.10.1.3.4242: UDP, length 304
2023-07-13 20:46:36.640205 IP 10.10.1.2.4242 > 10.10.1.3.4242: UDP, length 296
2023-07-13 20:46:36.640441 IP 10.10.1.3.4242 > 10.10.1.2.4242: UDP, length 84
2023-07-13 20:46:36.640471 IP 10.10.1.2.4242 > 10.10.1.3.4242: UDP, length 208
2023-07-13 20:46:36.640562 IP 10.10.1.2.4242 > 10.10.1.3.4242: UDP, length 136
2023-07-13 20:46:36.640715 IP 10.10.1.3.4242 > 10.10.1.2.4242: UDP, length 84
2023-07-13 20:46:36.641106 IP 10.10.1.2.4242 > 10.10.1.3.4242: UDP, length 200
2023-07-13 20:46:36.641373 IP 10.10.1.2.4242 > 10.10.1.3.4242: UDP, length 136
2023-07-13 20:46:36.641516 IP 10.10.1.2.4242 > 10.10.1.3.4242: UDP, length 184
2023-07-13 20:46:36.641594 IP 10.10.1.3.4242 > 10.10.1.2.4242: UDP, length 84
2023-07-13 20:46:36.642629 IP 10.10.1.2.4242 > 10.10.1.3.4242: UDP, length 144
2023-07-13 20:46:36.642658 IP 10.10.1.2.4242 > 10.10.1.3.4242: UDP, length 184
2023-07-13 20:46:36.642717 IP 10.10.1.2.4242 > 10.10.1.3.4242: UDP, length 120
2023-07-13 20:46:36.642787 IP 10.10.1.2.4242 > 10.10.1.3.4242: UDP, length 144
2023-07-13 20:46:36.642828 IP 10.10.1.3.4242 > 10.10.1.2.4242: UDP, length 84
2023-07-13 20:46:36.642940 IP 10.10.1.3.4242 > 10.10.1.2.4242: UDP, length 84
2023-07-13 20:46:36.645050 IP 10.10.1.2.4242 > 10.10.1.3.4242: UDP, length 448
2023-07-13 20:46:36.645996 IP 10.10.1.2.4242 > 10.10.1.3.4242: UDP, length 320
2023-07-13 20:46:36.646168 IP 10.10.1.2.4242 > 10.10.1.3.4242: UDP, length 184
2023-07-13 20:46:36.646217 IP 10.10.1.3.4242 > 10.10.1.2.4242: UDP, length 84
2023-07-13 20:46:36.646999 IP 10.10.1.2.4242 > 10.10.1.3.4242: UDP, length 184
2023-07-13 20:46:36.647028 IP 10.10.1.2.4242 > 10.10.1.3.4242: UDP, length 144
2023-07-13 20:46:36.647238 IP 10.10.1.2.4242 > 10.10.1.3.4242: UDP, length 144
2023-07-13 20:46:36.647275 IP 10.10.1.3.4242 > 10.10.1.2.4242: UDP, length 84
2023-07-13 20:46:36.649664 IP 10.10.1.2.4242 > 10.10.1.3.4242: UDP, length 472
2023-07-13 20:46:36.649693 IP 10.10.1.2.4242 > 10.10.1.3.4242: UDP, length 296
2023-07-13 20:46:36.649947 IP 10.10.1.2.4242 > 10.10.1.3.4242: UDP, length 136
2023-07-13 20:46:36.649987 IP 10.10.1.3.4242 > 10.10.1.2.4242: UDP, length 84
2023-07-13 20:46:36.650900 IP 10.10.1.2.4242 > 10.10.1.3.4242: UDP, length 136
2023-07-13 20:46:36.651022 IP 10.10.1.2.4242 > 10.10.1.3.4242: UDP, length 184
2023-07-13 20:46:36.651095 IP 10.10.1.3.4242 > 10.10.1.2.4242: UDP, length 84
2023-07-13 20:46:36.651150 IP 10.10.1.2.4242 > 10.10.1.3.4242: UDP, length 136
2023-07-13 20:46:36.651335 IP 10.10.1.3.4242 > 10.10.1.2.4242: UDP, length 84
2023-07-13 20:46:36.651438 IP 10.10.1.2.4242 > 10.10.1.3.4242: UDP, length 120
2023-07-13 20:46:36.651522 IP 10.10.1.2.4242 > 10.10.1.3.4242: UDP, length 184
2023-07-13 20:46:36.651773 IP 10.10.1.3.4242 > 10.10.1.2.4242: UDP, length 84
2023-07-13 20:46:36.652804 IP 10.10.1.2.4242 > 10.10.1.3.4242: UDP, length 144
2023-07-13 20:46:36.653860 IP 10.10.1.2.4242 > 10.10.1.3.4242: UDP, length 208
2023-07-13 20:46:36.653888 IP 10.10.1.2.4242 > 10.10.1.3.4242: UDP, length 200
2023-07-13 20:46:36.654123 IP 10.10.1.3.4242 > 10.10.1.2.4242: UDP, length 84
2023-07-13 20:46:36.654487 IP 10.10.1.2.4242 > 10.10.1.3.4242: UDP, length 136
2023-07-13 20:46:36.655061 IP 10.10.1.2.4242 > 10.10.1.3.4242: UDP, length 304
