2023-07-13 20:46:36.374811 IP 10.10.200.2.22 > 10.10.200.9.55322: Flags [P.], seq 609084935:609085123, ack 1469087554, win 503, options [nop,nop,TS val 2205267032 ecr 870503389], length 188
2023-07-13 20:46:36.375462 IP 10.10.200.9.55322 > 10.10.200.2.22: Flags [.], ack 188, win 8735, options [nop,nop,TS val 870503422 ecr 2205267032], length 0
2023-07-13 20:46:36.390621 IP 10.10.200.2.22 > 10.10.200.9.55322: Flags [P.], seq 188:384, ack 1, win 503, options [nop,nop,TS val 2205267048 ecr 870503422], length 196
2023-07-13 20:46:36.391411 IP 10.10.200.9.55322 > 10.10.200.2.22: Flags [.], ack 384, win 8735, options [nop,nop,TS val 870503438 ecr 2205267048], length 0
2023-07-13 20:46:36.441362 IP 10.10.200.2.22 > 10.10.200.9.55322: Flags [P.], seq 384:484, ack 1, win 503, options [nop,nop,TS val 2205267099 ecr 870503438], length 100
2023-07-13 20:46:36.441749 IP 10.10.200.2.22 > 10.10.200.9.55322: Flags [P.], seq 484:544, ack 1, win 503, options [nop,nop,TS val 2205267099 ecr 870503438], length 60
2023-07-13 20:46:36.442026 IP 10.10.200.9.55322 > 10.10.200.2.22: Flags [.], ack 484, win 8735, options [nop,nop,TS val 870503489 ecr 2205267099], length 0
2023-07-13 20:46:36.442082 IP 10.10.200.9.55322 > 10.10.200.2.22: Flags [.], ack 544, win 8735, options [nop,nop,TS val 870503489 ecr 2205267099], length 0
2023-07-13 20:46:36.443701 IP 10.10.200.2.22 > 10.10.200.9.55322: Flags [P.], seq 544:780, ack 1, win 503, options [nop,nop,TS val 2205267101 ecr 870503489], length 236
2023-07-13 20:46:36.443997 IP 10.10.200.2.22 > 10.10.200.9.55322: Flags [P.], seq 780:1008, ack 1, win 503, options [nop,nop,TS val 2205267102 ecr 870503489], length 228
2023-07-13 20:46:36.444215 IP 10.10.200.9.55322 > 10.10.200.2.22: Flags [.], ack 780, win 8735, options [nop,nop,TS val 870503491 ecr 2205267101], length 0
2023-07-13 20:46:36.444428 IP 10.10.200.9.55322 > 10.10.200.2.22: Flags [.], ack 1008, win 8735, options [nop,nop,TS val 870503491 ecr 2205267102], length 0
2023-07-13 20:46:36.444604 IP 10.10.200.2.22 > 10.10.200.9.55322: Flags [P.], seq 1008:1060, ack 1, win 503, options [nop,nop,TS val 2205267102 ecr 870503491], length 52
2023-07-13 20:46:36.445186 IP 10.10.200.9.55322 > 10.10.200.2.22: Flags [.], ack 1060, win 8735, options [nop,nop,TS val 870503492 ecr 2205267102], length 0
2023-07-13 20:46:36.445506 IP 10.10.200.2.22 > 10.10.200.9.55322: Flags [P.], seq 1060:1160, ack 1, win 503, options [nop,nop,TS val 2205267103 ecr 870503492], length 100
2023-07-13 20:46:36.446019 IP 10.10.200.9.55322 > 10.10.200.2.22: Flags [.], ack 1160, win 8735, options [nop,nop,TS val 870503493 ecr 2205267103], length 0
2023-07-13 20:46:36.446065 IP 10.10.200.2.22 > 10.10.200.9.55322: Flags [P.], seq 1160:1220, ack 1, win 503, options [nop,nop,TS val 2205267104 ecr 870503492], length 60
2023-07-13 20:46:36.446575 IP 10.10.200.9.55322 > 10.10.200.2.22: Flags [.], ack 1220, win 8735, options [nop,nop,TS val 870503493 ecr 2205267104], length 0
2023-07-13 20:46:36.447926 IP 10.10.200.2.22 > 10.10.200.9.55322: Flags [P.], seq 1220:1424, ack 1, win 503, options [nop,nop,TS val 2205267105 ecr 870503493], length 204
2023-07-13 20:46:36.447982 IP 10.10.200.2.22 > 10.10.200.9.55322: Flags [P.], seq 1424:1620, ack 1, win 503, options [nop,nop,TS val 2205267106 ecr 870503493], length 196
2023-07-13 20:46:36.448427 IP 10.10.200.2.22 > 10.10.200.9.55322: Flags [P.], seq 1620:1672, ack 1, win 503, options [nop,nop,TS val 2205267106 ecr 870503493], length 52
2023-07-13 20:46:36.448439 IP 10.10.200.9.55322 > 10.10.200.2.22: Flags [.], ack 1620, win 8735, options [nop,nop,TS val 870503495 ecr 2205267105], length 0
2023-07-13 20:46:36.448482 IP 10.10.200.2.22 > 10.10.200.9.55322: Flags [P.], seq 1672:1708, ack 1, win 503, options [nop,nop,TS val 2205267106 ecr 870503495], length 36
2023-07-13 20:46:36.448819 IP 10.10.200.9.55322 > 10.10.200.2.22: Flags [.], ack 1708, win 8735, options [nop,nop,TS val 870503496 ecr 2205267106], length 0
2023-07-13 20:46:36.449522 IP 10.10.200.2.22 > 10.10.200.9.55322: Flags [P.], seq 1708:1808, ack 1, win 503, options [nop,nop,TS val 2205267107 ecr 870503496], length 100
2023-07-13 20:46:36.449840 IP 10.10.200.2.22 > 10.10.200.9.55322: Flags [P.], seq 1808:1868, ack 1, win 503, options [nop,nop,TS val 2205267107 ecr 870503496], length 60
2023-07-13 20:46:36.450082 IP 10.10.200.9.55322 > 10.10.200.2.22: Flags [.], ack 1808, win 8735, options [nop,nop,TS val 870503497 ecr 2205267107], length 0
2023-07-13 20:46:36.450222 IP 10.10.200.9.55322 > 10.10.200.2.22: Flags [.], ack 1868, win 8735, options [nop,nop,TS val 870503497 ecr 2205267107], length 0
2023-07-13 20:46:36.451737 IP 10.10.200.2.22 > 10.10.200.9.55322: Flags [P.], seq 1868:2088, ack 1, win 503, options [nop,nop,TS val 2205267109 ecr 870503497], length 220
2023-07-13 20:46:36.451925 IP 10.10.200.2.22 > 10.10.200.9.55322: Flags [P.], seq 2088:2292, ack 1, win 503, options [nop,nop,TS val 2205267109 ecr 870503497], length 204
2023-07-13 20:46:36.452202 IP 10.10.200.9.55322 > 10.10.200.2.22: Flags [.], ack 2088, win 8735, options [nop,nop,TS val 870503499 ecr 2205267109], length 0
2023-07-13 20:46:36.452401 IP 10.10.200.9.55322 > 10.10.200.2.22: Flags [.], ack 2292, win 8735, options [nop,nop,TS val 870503499 ecr 2205267109], length 0
2023-07-13 20:46:36.453121 IP 10.10.200.2.22 > 10.10.200.9.55322: Flags [P.], seq 2292:2344, ack 1, win 503, options [nop,nop,TS val 2205267111 ecr 870503499], length 52
2023-07-13 20:46:36.453452 IP 10.10.200.2.22 > 10.10.200.9.55322: Flags [P.], seq 2344:2444, ack 1, win 503, options [nop,nop,TS val 2205267111 ecr 870503499], length 100
2023-07-13 20:46:36.453713 IP 10.10.200.9.55322 > 10.10.200.2.22: Flags [.], ack 2344, win 8735, options [nop,nop,TS val 870503500 ecr 2205267111], length 0
2023-07-13 20:46:36.453894 IP 10.10.200.2.22 > 10.10.200.9.55322: Flags [P.], seq 2444:2504, ack 1, win 503, options [nop,nop,TS val 2205267111 ecr 870503500], length 60
2023-07-13 20:46:36.453936 IP 10.10.200.9.55322 > 10.10.200.2.22: Flags [.], ack 2444, win 8735, options [nop,nop,TS val 870503501 ecr 2205267111], length 0
2023-07-13 20:46:36.454314 IP 10.10.200.9.55322 > 10.10.200.2.22: Flags [.], ack 2504, win 8735, options [nop,nop,TS val 870503501 ecr 2205267111], length 0
2023-07-13 20:46:36.455781 IP 10.10.200.2.22 > 10.10.200.9.55322: Flags [P.], seq 2504:2708, ack 1, win 503, options [nop,nop,TS val 2205267113 ecr 870503501], length 204
2023-07-13 20:46:36.455821 IP 10.10.200.2.22 > 10.10.200.9.55322: Flags [P.], seq 2708:2904, ack 1, win 503, options [nop,nop,TS val 2205267113 ecr 870503501], length 196
2023-07-13 20:46:36.456362 IP 10.10.200.2.22 > 10.10.200.9.55322: Flags [P.], seq 2904:2956, ack 1, win 503, options [nop,nop,TS val 2205267114 ecr 870503501], length 52
2023-07-13 20:46:36.456369 IP 10.10.200.9.55322 > 10.10.200.2.22: Flags [.], ack 2904, win 8735, options [nop,nop,TS val 870503503 ecr 2205267113], length 0
2023-07-13 20:46:36.456861 IP 10.10.200.9.55322 > 10.10.200.2.22: Flags [.], ack 2956, win 8735, options [nop,nop,TS val 870503504 ecr 2205267114], length 0
2023-07-13 20:46:36.461181 IP 10.10.200.2.22 > 10.10.200.9.55322: Flags [P.], seq 2956:3056, ack 1, win 503, options [nop,nop,TS val 2205267119 ecr 870503504], length 100
2023-07-13 20:46:36.461494 IP 10.10.200.2.22 > 10.10.200.9.55322: Flags [P.], seq 3056:3116, ack 1, win 503, options [nop,nop,TS val 2205267119 ecr 870503504], length 60
2023-07-13 20:46:36.461889 IP 10.10.200.9.55322 > 10.10.200.2.22: Flags [.], ack 3056, win 8735, options [nop,nop,TS val 870503509 ecr 2205267119], length 0
2023-07-13 20:46:36.461943 IP 10.10.200.9.55322 > 10.10.200.2.22: Flags [.], ack 3116, win 8735, options [nop,nop,TS val 870503509 ecr 2205267119], length 0
2023-07-13 20:46:36.463443 IP 10.10.200.2.22 > 10.10.200.9.55322: Flags [P.], seq 3116:3240, ack 1, win 503, options [nop,nop,TS val 2205267121 ecr 870503509], length 124
2023-07-13 20:46:36.463604 IP 10.10.200.2.22 > 10.10.200.9.55322: Flags [P.], seq 3240:3356, ack 1, win 503, options [nop,nop,TS val 2205267121 ecr 870503509], length 116
2023-07-13 20:46:36.464061 IP 10.10.200.9.55322 > 10.10.200.2.22: Flags [.], ack 3240, win 8735, options [nop,nop,TS val 870503511 ecr 2205267121], length 0
2023-07-13 20:46:36.464098 IP 10.10.200.9.55322 > 10.10.200.2.22: Flags [.], ack 3356, win 8735, options [nop,nop,TS val 870503511 ecr 2205267121], length 0
2023-07-13 20:46:36.464311 IP 10.10.200.2.22 > 10.10.200.9.55322: Flags [P.], seq 3356:3408, ack 1, win 503, options [nop,nop,TS val 2205267122 ecr 870503511], length 52
2023-07-13 20:46:36.464866 IP 10.10.200.9.55322 > 10.10.200.2.22: Flags [.], ack 3408, win 8735, options [nop,nop,TS val 870503512 ecr 2205267122], length 0
2023-07-13 20:46:36.464980 IP 10.10.200.2.22 > 10.10.200.9.55322: Flags [P.], seq 3408:3508, ack 1, win 503, options [nop,nop,TS val 2205267122 ecr 870503512], length 100
2023-07-13 20:46:36.465426 IP 10.10.200.2.22 > 10.10.200.9.55322: Flags [P.], seq 3508:3568, ack 1, win 503, options [nop,nop,TS val 2205267123 ecr 870503512], length 60
2023-07-13 20:46:36.465555 IP 10.10.200.9.55322 > 10.10.200.2.22: Flags [.], ack 3508, win 8735, options [nop,nop,TS val 870503512 ecr 2205267122], length 0
2023-07-13 20:46:36.465927 IP 10.10.200.9.55322 > 10.10.200.2.22: Flags [.], ack 3568, win 8735, options [nop,nop,TS val 870503513 ecr 2205267123], length 0
2023-07-13 20:46:36.465954 IP 10.10.200.9.55322 > 10.10.200.2.22: Flags [P.], seq 1:37, ack 3568, win 8735, options [nop,nop,TS val 870503513 ecr 2205267123], length 36
2023-07-13 20:46:36.467327 IP 10.10.200.2.22 > 10.10.200.9.55322: Flags [P.], seq 3568:3692, ack 37, win 503, options [nop,nop,TS val 2205267125 ecr 870503513], length 124
2023-07-13 20:46:36.467361 IP 10.10.200.2.22 > 10.10.200.9.55322: Flags [P.], seq 3692:3808, ack 37, win 503, options [nop,nop,TS val 2205267125 ecr 870503513], length 116
2023-07-13 20:46:36.467718 IP 10.10.200.2.22 > 10.10.200.9.55322: Flags [P.], seq 3808:3860, ack 37, win 503, options [nop,nop,TS val 2205267125 ecr 870503513], length 52
2023-07-13 20:46:36.467894 IP 10.10.200.9.55322 > 10.10.200.2.22: Flags [.], ack 3808, win 8735, options [nop,nop,TS val 870503515 ecr 2205267125], length 0
2023-07-13 20:46:36.468706 IP 10.10.200.2.22 > 10.10.200.9.55322: Flags [P.], seq 3860:3960, ack 37, win 503, options [nop,nop,TS val 2205267126 ecr 870503515], length 100
2023-07-13 20:46:36.469076 IP 10.10.200.2.22 > 10.10.200.9.55322: Flags [P.], seq 3960:4020, ack 37, win 503, options [nop,nop,TS val 2205267127 ecr 870503515], length 60
2023-07-13 20:46:36.469247 IP 10.10.200.9.55322 > 10.10.200.2.22: Flags [.], ack 3960, win 8735, options [nop,nop,TS val 870503516 ecr 2205267125], length 0
2023-07-13 20:46:36.471145 IP 10.10.200.2.22 > 10.10.200.9.55322: Flags [P.], seq 4020:4144, ack 37, win 503, options [nop,nop,TS val 2205267129 ecr 870503516], length 124
2023-07-13 20:46:36.471330 IP 10.10.200.2.22 > 10.10.200.9.55322: Flags [P.], seq 4144:4260, ack 37, win 503, options [nop,nop,TS val 2205267129 ecr 870503516], length 116
2023-07-13 20:46:36.471674 IP 10.10.200.9.55322 > 10.10.200.2.22: Flags [.], ack 4144, win 8735, options [nop,nop,TS val 870503518 ecr 2205267127], length 0
2023-07-13 20:46:36.472014 IP 10.10.200.2.22 > 10.10.200.9.55322: Flags [P.], seq 4260:4312, ack 37, win 503, options [nop,nop,TS val 2205267130 ecr 870503518], length 52
2023-07-13 20:46:36.472520 IP 10.10.200.9.55322 > 10.10.200.2.22: Flags [.], ack 4312, win 8735, options [nop,nop,TS val 870503519 ecr 2205267129], length 0
2023-07-13 20:46:36.472835 IP 10.10.200.2.22 > 10.10.200.9.55322: Flags [P.], seq 4312:4412, ack 37, win 503, options [nop,nop,TS val 2205267130 ecr 870503519], length 100
2023-07-13 20:46:36.473175 IP 10.10.200.2.22 > 10.10.200.9.55322: Flags [P.], seq 4412:4472, ack 37, win 503, options [nop,nop,TS val 2205267131 ecr 870503519], length 60
2023-07-13 20:46:36.473750 IP 10.10.200.9.55322 > 10.10.200.2.22: Flags [.], ack 4472, win 8735, options [nop,nop,TS val 870503520 ecr 2205267130], length 0
2023-07-13 20:46:36.474992 IP 10.10.200.2.22 > 10.10.200.9.55322: Flags [P.], seq 4472:4596, ack 37, win 503, options [nop,nop,TS val 2205267132 ecr 870503520], length 124
2023-07-13 20:46:36.475205 IP 10.10.200.2.22 > 10.10.200.9.55322: Flags [P.], seq 4596:4712, ack 37, win 503, options [nop,nop,TS val 2205267133 ecr 870503520], length 116
2023-07-13 20:46:36.475611 IP 10.10.200.9.55322 > 10.10.200.2.22: Flags [.], ack 4712, win 8735, options [nop,nop,TS val 870503522 ecr 2205267132], length 0
2023-07-13 20:46:36.475887 IP 10.10.200.2.22 > 10.10.200.9.55322: Flags [P.], seq 4712:4764, ack 37, win 503, options [nop,nop,TS val 2205267133 ecr 870503522], length 52
2023-07-13 20:46:36.476613 IP 10.10.200.2.22 > 10.10.200.9.55322: Flags [P.], seq 4764:4864, ack 37, win 503, options [nop,nop,TS val 2205267134 ecr 870503522], length 100
2023-07-13 20:46:36.476935 IP 10.10.200.2.22 > 10.10.200.9.55322: Flags [P.], seq 4864:4924, ack 37, win 503, options [nop,nop,TS val 2205267134 ecr 870503522], length 60
2023-07-13 20:46:36.477150 IP 10.10.200.9.55322 > 10.10.200.2.22: Flags [.], ack 4864, win 8735, options [nop,nop,TS val 870503524 ecr 2205267133], length 0
2023-07-13 20:46:36.478814 IP 10.10.200.2.22 > 10.10.200.9.55322: Flags [P.], seq 4924:5128, ack 37, win 503, options [nop,nop,TS val 2205267136 ecr 870503524], length 204
2023-07-13 20:46:36.479299 IP 10.10.200.2.22 > 10.10.200.9.55322: Flags [P.], seq 5128:5180, ack 37, win 503, options [nop,nop,TS val 2205267137 ecr 870503524], length 52
2023-07-13 20:46:36.479350 IP 10.10.200.9.55322 > 10.10.200.2.22: Flags [.], ack 5128, win 8735, options [nop,nop,TS val 870503526 ecr 2205267134], length 0
2023-07-13 20:46:36.480123 IP 10.10.200.2.22 > 10.10.200.9.55322: Flags [P.], seq 5180:5280, ack 37, win 503, options [nop,nop,TS val 2205267138 ecr 870503526], length 100
2023-07-13 20:46:36.480499 IP 10.10.200.2.22 > 10.10.200.9.55322: Flags [P.], seq 5280:5340, ack 37, win 503, options [nop,nop,TS val 2205267138 ecr 870503526], length 60
2023-07-13 20:46:36.480742 IP 10.10.200.9.55322 > 10.10.200.2.22: Flags [.], ack 5280, win 8735, options [nop,nop,TS val 870503527 ecr 2205267137], length 0
2023-07-13 20:46:36.482406 IP 10.10.200.2.22 > 10.10.200.9.55322: Flags [P.], seq 5340:5464, ack 37, win 503, options [nop,nop,TS val 2205267140 ecr 870503527], length 124
2023-07-13 20:46:36.482838 IP 10.10.200.2.22 > 10.10.200.9.55322: Flags [P.], seq 5464:5580, ack 37, win 503, options [nop,nop,TS val 2205267140 ecr 870503527], length 116
2023-07-13 20:46:36.482994 IP 10.10.200.9.55322 > 10.10.200.2.22: Flags [.], ack 5464, win 8735, options [nop,nop,TS val 870503530 ecr 2205267138], length 0
2023-07-13 20:46:36.483392 IP 10.10.200.2.22 > 10.10.200.9.55322: Flags [P.], seq 5580:5632, ack 37, win 503, options [nop,nop,TS val 2205267141 ecr 870503530], length 52
2023-07-13 20:46:36.483930 IP 10.10.200.9.55322 > 10.10.200.2.22: Flags [.], ack 5632, win 8735, options [nop,nop,TS val 870503531 ecr 2205267140], length 0
2023-07-13 20:46:36.484392 IP 10.10.200.2.22 > 10.10.200.9.55322: Flags [P.], seq 5632:5732, ack 37, win 503, options [nop,nop,TS val 2205267142 ecr 870503531], length 100
2023-07-13 20:46:36.484663 IP 10.10.200.2.22 > 10.10.200.9.55322: Flags [P.], seq 5732:5792, ack 37, win 503, options [nop,nop,TS val 2205267142 ecr 870503531], length 60
2023-07-13 20:46:36.485128 IP 10.10.200.9.55322 > 10.10.200.2.22: Flags [.], ack 5792, win 8735, options [nop,nop,TS val 870503532 ecr 2205267142], length 0
2023-07-13 20:46:36.486565 IP 10.10.200.2.22 > 10.10.200.9.55322: Flags [P.], seq 5792:5916, ack 37, win 503, options [nop,nop,TS val 2205267144 ecr 870503532], length 124
2023-07-13 20:46:36.486790 IP 10.10.200.2.22 > 10.10.200.9.55322: Flags [P.], seq 5916:6032, ack 37, win 503, options [nop,nop,TS val 2205267144 ecr 870503532], length 116
2023-07-13 20:46:36.487170 IP 10.10.200.9.55322 > 10.10.200.2.22: Flags [.], ack 6032, win 8735, options [nop,nop,TS val 870503534 ecr 2205267144], length 0
2023-07-13 20:46:36.487475 IP 10.10.200.2.22 > 10.10.200.9.55322: Flags [P.], seq 6032:6084, ack 37, win 503, options [nop,nop,TS val 2205267145 ecr 870503534], length 52
2023-07-13 20:46:36.488236 IP 10.10.200.2.22 > 10.10.200.9.55322: Flags [P.], seq 6084:6184, ack 37, win 503, options [nop,nop,TS val 2205267146 ecr 870503534], length 100
2023-07-13 20:46:36.488630 IP 10.10.200.9.55322 > 10.10.200.2.22: Flags [.], ack 6184, win 8735, options [nop,nop,TS val 870503535 ecr 2205267145], length 0
2023-07-13 20:46:36.489000 IP 10.10.200.2.22 > 10.10.200.9.55322: Flags [P.], seq 6184:6244, ack 37, win 503, options [nop,nop,TS val 2205267147 ecr 870503535], length 60
2023-07-13 20:46:36.490886 IP 10.10.200.2.22 > 10.10.200.9.55322: Flags [P.], seq 6244:6368, ack 37, win 503, options [nop,nop,TS val 2205267148 ecr 870503535], length 124
2023-07-13 20:46:36.491315 IP 10.10.200.2.22 > 10.10.200.9.55322: Flags [P.], seq 6368:6484, ack 37, win 503, options [nop,nop,TS val 2205267149 ecr 870503535], length 116
2023-07-13 20:46:36.491514 IP 10.10.200.9.55322 > 10.10.200.2.22: Flags [.], ack 6368, win 8735, options [nop,nop,TS val 870503538 ecr 2205267147], length 0
2023-07-13 20:46:36.491804 IP 10.10.200.2.22 > 10.10.200.9.55322: Flags [P.], seq 6484:6536, ack 37, win 503, options [nop,nop,TS val 2205267149 ecr 870503538], length 52
2023-07-13 20:46:36.492376 IP 10.10.200.9.55322 > 10.10.200.2.22: Flags [.], ack 6536, win 8735, options [nop,nop,TS val 870503539 ecr 2205267149], length 0
2023-07-13 20:46:36.492617 IP 10.10.200.2.22 > 10.10.200.9.55322: Flags [P.], seq 6536:6636, ack 37, win 503, options [nop,nop,TS val 2205267150 ecr 870503539], length 100
2023-07-13 20:46:36.493016 IP 10.10.200.2.22 > 10.10.200.9.55322: Flags [P.], seq 6636:6696, ack 37, win 503, options [nop,nop,TS val 2205267151 ecr 870503539], length 60
2023-07-13 20:46:36.493512 IP 10.10.200.9.55322 > 10.10.200.2.22: Flags [.], ack 6696, win 8735, options [nop,nop,TS val 870503540 ecr 2205267150], length 0
2023-07-13 20:46:36.494855 IP 10.10.200.2.22 > 10.10.200.9.55322: Flags [P.], seq 6696:6820, ack 37, win 503, options [nop,nop,TS val 2205267152 ecr 870503540], length 124
2023-07-13 20:46:36.495273 IP 10.10.200.2.22 > 10.10.200.9.55322: Flags [P.], seq 6820:6936, ack 37, win 503, options [nop,nop,TS val 2205267153 ecr 870503540], length 116
2023-07-13 20:46:36.495731 IP 10.10.200.2.22 > 10.10.200.9.55322: Flags [P.], seq 6936:6988, ack 37, win 503, options [nop,nop,TS val 2205267153 ecr 870503540], length 52
2023-07-13 20:46:36.495855 IP 10.10.200.9.55322 > 10.10.200.2.22: Flags [.], ack 6936, win 8735, options [nop,nop,TS val 870503543 ecr 2205267152], length 0
2023-07-13 20:46:36.496625 IP 10.10.200.2.22 > 10.10.200.9.55322: Flags [P.], seq 6988:7088, ack 37, win 503, options [nop,nop,TS val 2205267154 ecr 870503543], length 100
2023-07-13 20:46:36.496993 IP 10.10.200.2.22 > 10.10.200.9.55322: Flags [P.], seq 7088:7148, ack 37, win 503, options [nop,nop,TS val 2205267155 ecr 870503543], length 60
2023-07-13 20:46:36.497201 IP 10.10.200.9.55322 > 10.10.200.2.22: Flags [.], ack 7088, win 8735, options [nop,nop,TS val 870503544 ecr 2205267153], length 0
2023-07-13 20:46:36.498875 IP 10.10.200.2.22 > 10.10.200.9.55322: Flags [P.], seq 7148:7272, ack 37, win 503, options [nop,nop,TS val 2205267156 ecr 870503544], length 124
2023-07-13 20:46:36.499128 IP 10.10.200.2.22 > 10.10.200.9.55322: Flags [P.], seq 7272:7388, ack 37, win 503, options [nop,nop,TS val 2205267157 ecr 870503544], length 116
2023-07-13 20:46:36.499438 IP 10.10.200.9.55322 > 10.10.200.2.22: Flags [.], ack 7272, win 8735, options [nop,nop,TS val 870503546 ecr 2205267155], length 0
2023-07-13 20:46:36.499493 IP 10.10.200.2.22 > 10.10.200.9.55322: Flags [P.], seq 7388:7440, ack 37, win 503, options [nop,nop,TS val 2205267157 ecr 870503546], length 52
2023-07-13 20:46:36.499874 IP 10.10.200.9.55322 > 10.10.200.2.22: Flags [.], ack 7440, win 8735, options [nop,nop,TS val 870503547 ecr 2205267157], length 0
2023-07-13 20:46:36.500489 IP 10.10.200.2.22 > 10.10.200.9.55322: Flags [P.], seq 7440:7540, ack 37, win 503, options [nop,nop,TS val 2205267158 ecr 870503547], length 100
2023-07-13 20:46:36.500726 IP 10.10.200.2.22 > 10.10.200.9.55322: Flags [P.], seq 7540:7600, ack 37, win 503, options [nop,nop,TS val 2205267158 ecr 870503547], length 60
2023-07-13 20:46:36.501163 IP 10.10.200.9.55322 > 10.10.200.2.22: Flags [.], ack 7600, win 8735, options [nop,nop,TS val 870503548 ecr 2205267158], length 0
2023-07-13 20:46:36.502651 IP 10.10.200.2.22 > 10.10.200.9.55322: Flags [P.], seq 7600:7724, ack 37, win 503, options [nop,nop,TS val 2205267160 ecr 870503548], length 124
2023-07-13 20:46:36.502859 IP 10.10.200.2.22 > 10.10.200.9.55322: Flags [P.], seq 7724:7840, ack 37, win 503, options [nop,nop,TS val 2205267160 ecr 870503548], length 116
2023-07-13 20:46:36.503262 IP 10.10.200.9.55322 > 10.10.200.2.22: Flags [.], ack 7840, win 8735, options [nop,nop,TS val 870503550 ecr 2205267160], length 0
2023-07-13 20:46:36.503491 IP 10.10.200.2.22 > 10.10.200.9.55322: Flags [P.], seq 7840:7892, ack 37, win 503, options [nop,nop,TS val 2205267161 ecr 870503550], length 52
2023-07-13 20:46:36.504431 IP 10.10.200.2.22 > 10.10.200.9.55322: Flags [P.], seq 7892:7992, ack 37, win 503, options [nop,nop,TS val 2205267162 ecr 870503550], length 100
2023-07-13 20:46:36.504909 IP 10.10.200.9.55322 > 10.10.200.2.22: Flags [.], ack 7992, win 8735, options [nop,nop,TS val 870503552 ecr 2205267161], length 0
2023-07-13 20:46:36.505651 IP 10.10.200.2.22 > 10.10.200.9.55322: Flags [P.], seq 7992:8052, ack 37, win 503, options [nop,nop,TS val 2205267163 ecr 870503552], length 60
2023-07-13 20:46:36.507598 IP 10.10.200.2.22 > 10.10.200.9.55322: Flags [P.], seq 8052:8176, ack 37, win 503, options [nop,nop,TS val 2205267165 ecr 870503552], length 124
2023-07-13 20:46:36.507862 IP 10.10.200.2.22 > 10.10.200.9.55322: Flags [P.], seq 8176:8292, ack 37, win 503, options [nop,nop,TS val 2205267165 ecr 870503552], length 116
2023-07-13 20:46:36.508031 IP 10.10.200.9.55322 > 10.10.200.2.22: Flags [.], ack 8176, win 8735, options [nop,nop,TS val 870503555 ecr 2205267163], length 0
2023-07-13 20:46:36.508527 IP 10.10.200.2.22 > 10.10.200.9.55322: Flags [P.], seq 8292:8344, ack 37, win 503, options [nop,nop,TS val 2205267166 ecr 870503555], length 52
2023-07-13 20:46:36.508863 IP 10.10.200.9.55322 > 10.10.200.2.22: Flags [.], ack 8344, win 8735, options [nop,nop,TS val 870503556 ecr 2205267165], length 0
2023-07-13 20:46:36.509646 IP 10.10.200.2.22 > 10.10.200.9.55322: Flags [P.], seq 8344:8444, ack 37, win 503, options [nop,nop,TS val 2205267167 ecr 870503556], length 100
2023-07-13 20:46:36.509698 IP 10.10.200.2.22 > 10.10.200.9.55322: Flags [P.], seq 8444:8504, ack 37, win 503, options [nop,nop,TS val 2205267167 ecr 870503556], length 60
2023-07-13 20:46:36.510190 IP 10.10.200.9.55322 > 10.10.200.2.22: Flags [.], ack 8504, win 8735, options [nop,nop,TS val 870503557 ecr 2205267167], length 0
2023-07-13 20:46:36.512058 IP 10.10.200.2.22 > 10.10.200.9.55322: Flags [P.], seq 8504:8708, ack 37, win 503, options [nop,nop,TS val 2205267170 ecr 870503557], length 204
2023-07-13 20:46:36.513306 IP 10.10.200.2.22 > 10.10.200.9.55322: Flags [P.], seq 8708:8760, ack 37, win 503, options [nop,nop,TS val 2205267171 ecr 870503557], length 52
2023-07-13 20:46:36.513580 IP 10.10.200.2.22 > 10.10.200.9.55322: Flags [P.], seq 8760:8860, ack 37, win 503, options [nop,nop,TS val 2205267171 ecr 870503557], length 100
2023-07-13 20:46:36.513877 IP 10.10.200.9.55322 > 10.10.200.2.22: Flags [.], ack 8760, win 8735, options [nop,nop,TS val 870503561 ecr 2205267170], length 0
2023-07-13 20:46:36.514157 IP 10.10.200.2.22 > 10.10.200.9.55322: Flags [P.], seq 8860:8920, ack 37, win 503, options [nop,nop,TS val 2205267172 ecr 870503561], length 60
2023-07-13 20:46:36.514607 IP 10.10.200.9.55322 > 10.10.200.2.22: Flags [.], ack 8920, win 8735, options [nop,nop,TS val 870503561 ecr 2205267171], length 0
2023-07-13 20:46:36.516095 IP 10.10.200.2.22 > 10.10.200.9.55322: Flags [P.], seq 8920:9124, ack 37, win 503, options [nop,nop,TS val 2205267174 ecr 870503561], length 204
2023-07-13 20:46:36.516642 IP 10.10.200.2.22 > 10.10.200.9.55322: Flags [P.], seq 9124:9176, ack 37, win 503, options [nop,nop,TS val 2205267174 ecr 870503561], length 52
2023-07-13 20:46:36.517123 IP 10.10.200.9.55322 > 10.10.200.2.22: Flags [.], ack 9176, win 8735, options [nop,nop,TS val 870503564 ecr 2205267174], length 0
2023-07-13 20:46:36.517519 IP 10.10.200.2.22 > 10.10.200.9.55322: Flags [P.], seq 9176:9276, ack 37, win 503, options [nop,nop,TS val 2205267175 ecr 870503564], length 100
2023-07-13 20:46:36.517579 IP 10.10.200.2.22 > 10.10.200.9.55322: Flags [P.], seq 9276:9312, ack 37, win 503, options [nop,nop,TS val 2205267175 ecr 870503564], length 36
2023-07-13 20:46:36.517634 IP 10.10.200.2.22 > 10.10.200.9.55322: Flags [P.], seq 9312:9372, ack 37, win 503, options [nop,nop,TS val 2205267175 ecr 870503564], length 60
2023-07-13 20:46:36.518017 IP 10.10.200.9.55322 > 10.10.200.2.22: Flags [.], ack 9312, win 8735, options [nop,nop,TS val 870503565 ecr 2205267175], length 0
2023-07-13 20:46:36.519593 IP 10.10.200.2.22 > 10.10.200.9.55322: Flags [P.], seq 9372:9496, ack 37, win 503, options [nop,nop,TS val 2205267177 ecr 870503565], length 124
2023-07-13 20:46:36.519635 IP 10.10.200.2.22 > 10.10.200.9.55322: Flags [P.], seq 9496:9612, ack 37, win 503, options [nop,nop,TS val 2205267177 ecr 870503565], length 116
2023-07-13 20:46:36.520178 IP 10.10.200.9.55322 > 10.10.200.2.22: Flags [.], ack 9612, win 8735, options [nop,nop,TS val 870503567 ecr 2205267175], length 0
2023-07-13 20:46:36.520259 IP 10.10.200.2.22 > 10.10.200.9.55322: Flags [P.], seq 9612:9664, ack 37, win 503, options [nop,nop,TS val 2205267178 ecr 870503567], length 52
2023-07-13 20:46:36.520984 IP 10.10.200.2.22 > 10.10.200.9.55322: Flags [P.], seq 9664:9764, ack 37, win 503, options [nop,nop,TS val 2205267178 ecr 870503567], length 100
2023-07-13 20:46:36.521546 IP 10.10.200.9.55322 > 10.10.200.2.22: Flags [.], ack 9764, win 8735, options [nop,nop,TS val 870503568 ecr 2205267178], length 0
2023-07-13 20:46:36.521660 IP 10.10.200.2.22 > 10.10.200.9.55322: Flags [P.], seq 9764:9816, ack 37, win 503, options [nop,nop,TS val 2205267179 ecr 870503568], length 52
2023-07-13 20:46:36.521716 IP 10.10.200.2.22 > 10.10.200.9.55322: Flags [P.], seq 9816:9852, ack 37, win 503, options [nop,nop,TS val 2205267179 ecr 870503568], length 36
2023-07-13 20:46:36.522151 IP 10.10.200.9.55322 > 10.10.200.2.22: Flags [.], ack 9852, win 8735, options [nop,nop,TS val 870503569 ecr 2205267179], length 0
2023-07-13 20:46:36.523868 IP 10.10.200.2.22 > 10.10.200.9.55322: Flags [P.], seq 9852:9976, ack 37, win 503, options [nop,nop,TS val 2205267181 ecr 870503569], length 124
2023-07-13 20:46:36.524130 IP 10.10.200.2.22 > 10.10.200.9.55322: Flags [P.], seq 9976:10092, ack 37, win 503, options [nop,nop,TS val 2205267182 ecr 870503569], length 116
2023-07-13 20:46:36.524673 IP 10.10.200.9.55322 > 10.10.200.2.22: Flags [.], ack 10092, win 8735, options [nop,nop,TS val 870503571 ecr 2205267181], length 0
2023-07-13 20:46:36.525066 IP 10.10.200.2.22 > 10.10.200.9.55322: Flags [P.], seq 10092:10144, ack 37, win 503, options [nop,nop,TS val 2205267183 ecr 870503571], length 52
2023-07-13 20:46:36.525123 IP 10.10.200.2.22 > 10.10.200.9.55322: Flags [P.], seq 10144:10180, ack 37, win 503, options [nop,nop,TS val 2205267183 ecr 870503571], length 36
2023-07-13 20:46:36.525516 IP 10.10.200.9.55322 > 10.10.200.2.22: Flags [.], ack 10180, win 8735, options [nop,nop,TS val 870503572 ecr 2205267183], length 0
2023-07-13 20:46:36.526142 IP 10.10.200.2.22 > 10.10.200.9.55322: Flags [P.], seq 10180:10280, ack 37, win 503, options [nop,nop,TS val 2205267184 ecr 870503572], length 100
2023-07-13 20:46:36.526206 IP 10.10.200.2.22 > 10.10.200.9.55322: Flags [P.], seq 10280:10316, ack 37, win 503, options [nop,nop,TS val 2205267184 ecr 870503572], length 36
2023-07-13 20:46:36.526315 IP 10.10.200.2.22 > 10.10.200.9.55322: Flags [P.], seq 10316:10376, ack 37, win 503, options [nop,nop,TS val 2205267184 ecr 870503572], length 60
2023-07-13 20:46:36.526715 IP 10.10.200.9.55322 > 10.10.200.2.22: Flags [.], ack 10376, win 8735, options [nop,nop,TS val 870503573 ecr 2205267184], length 0
2023-07-13 20:46:36.528265 IP 10.10.200.2.22 > 10.10.200.9.55322: Flags [P.], seq 10376:10580, ack 37, win 503, options [nop,nop,TS val 2205267186 ecr 870503573], length 204
2023-07-13 20:46:36.528768 IP 10.10.200.2.22 > 10.10.200.9.55322: Flags [P.], seq 10580:10632, ack 37, win 503, options [nop,nop,TS val 2205267186 ecr 870503573], length 52
2023-07-13 20:46:36.529329 IP 10.10.200.9.55322 > 10.10.200.2.22: Flags [.], ack 10632, win 8735, options [nop,nop,TS val 870503576 ecr 2205267186], length 0
2023-07-13 20:46:36.529446 IP 10.10.200.2.22 > 10.10.200.9.55322: Flags [P.], seq 10632:10668, ack 37, win 503, options [nop,nop,TS val 2205267187 ecr 870503576], length 36
2023-07-13 20:46:36.529987 IP 10.10.200.2.22 > 10.10.200.9.55322: Flags [P.], seq 10668:10768, ack 37, win 503, options [nop,nop,TS val 2205267187 ecr 870503576], length 100
2023-07-13 20:46:36.530048 IP 10.10.200.2.22 > 10.10.200.9.55322: Flags [P.], seq 10768:10804, ack 37, win 503, options [nop,nop,TS val 2205267188 ecr 870503576], length 36
2023-07-13 20:46:36.530129 IP 10.10.200.2.22 > 10.10.200.9.55322: Flags [P.], seq 10804:10864, ack 37, win 503, options [nop,nop,TS val 2205267188 ecr 870503576], length 60
2023-07-13 20:46:36.530478 IP 10.10.200.9.55322 > 10.10.200.2.22: Flags [.], ack 10804, win 8735, options [nop,nop,TS val 870503577 ecr 2205267187], length 0
2023-07-13 20:46:36.532123 IP 10.10.200.2.22 > 10.10.200.9.55322: Flags [P.], seq 10864:10988, ack 37, win 503, options [nop,nop,TS val 2205267190 ecr 870503577], length 124
2023-07-13 20:46:36.532164 IP 10.10.200.2.22 > 10.10.200.9.55322: Flags [P.], seq 10988:11104, ack 37, win 503, options [nop,nop,TS val 2205267190 ecr 870503577], length 116
2023-07-13 20:46:36.532685 IP 10.10.200.9.55322 > 10.10.200.2.22: Flags [.], ack 11104, win 8735, options [nop,nop,TS val 870503579 ecr 2205267188], length 0
2023-07-13 20:46:36.532854 IP 10.10.200.2.22 > 10.10.200.9.55322: Flags [P.], seq 11104:11156, ack 37, win 503, options [nop,nop,TS val 2205267190 ecr 870503579], length 52
2023-07-13 20:46:36.533485 IP 10.10.200.2.22 > 10.10.200.9.55322: Flags [P.], seq 11156:11192, ack 37, win 503, options [nop,nop,TS val 2205267191 ecr 870503579], length 36
2023-07-13 20:46:36.533714 IP 10.10.200.2.22 > 10.10.200.9.55322: Flags [P.], seq 11192:11292, ack 37, win 503, options [nop,nop,TS val 2205267191 ecr 870503579], length 100
2023-07-13 20:46:36.533983 IP 10.10.200.9.55322 > 10.10.200.2.22: Flags [.], ack 11192, win 8735, options [nop,nop,TS val 870503581 ecr 2205267190], length 0
2023-07-13 20:46:36.534418 IP 10.10.200.2.22 > 10.10.200.9.55322: Flags [P.], seq 11292:11344, ack 37, win 503, options [nop,nop,TS val 2205267192 ecr 870503581], length 52
2023-07-13 20:46:36.534475 IP 10.10.200.2.22 > 10.10.200.9.55322: Flags [P.], seq 11344:11380, ack 37, win 503, options [nop,nop,TS val 2205267192 ecr 870503581], length 36
2023-07-13 20:46:36.534860 IP 10.10.200.9.55322 > 10.10.200.2.22: Flags [.], ack 11380, win 8735, options [nop,nop,TS val 870503582 ecr 2205267191], length 0
2023-07-13 20:46:36.536582 IP 10.10.200.2.22 > 10.10.200.9.55322: Flags [P.], seq 11380:11504, ack 37, win 503, options [nop,nop,TS val 2205267194 ecr 870503582], length 124
2023-07-13 20:46:36.536645 IP 10.10.200.2.22 > 10.10.200.9.55322: Flags [P.], seq 11504:11540, ack 37, win 503, options [nop,nop,TS val 2205267194 ecr 870503582], length 36
2023-07-13 20:46:36.537039 IP 10.10.200.2.22 > 10.10.200.9.55322: Flags [P.], seq 11540:11656, ack 37, win 503, options [nop,nop,TS val 2205267195 ecr 870503582], length 116
2023-07-13 20:46:36.537161 IP 10.10.200.9.55322 > 10.10.200.2.22: Flags [.], ack 11540, win 8735, options [nop,nop,TS val 870503584 ecr 2205267194], length 0
2023-07-13 20:46:36.537244 IP 10.10.200.2.22 > 10.10.200.9.55322: Flags [P.], seq 11656:11692, ack 37, win 503, options [nop,nop,TS val 2205267195 ecr 870503584], length 36
2023-07-13 20:46:36.537535 IP 10.10.200.9.55322 > 10.10.200.2.22: Flags [.], ack 11692, win 8735, options [nop,nop,TS val 870503584 ecr 2205267195], length 0
2023-07-13 20:46:36.537783 IP 10.10.200.2.22 > 10.10.200.9.55322: Flags [P.], seq 11692:11744, ack 37, win 503, options [nop,nop,TS val 2205267195 ecr 870503584], length 52
2023-07-13 20:46:36.537848 IP 10.10.200.2.22 > 10.10.200.9.55322: Flags [P.], seq 11744:11780, ack 37, win 503, options [nop,nop,TS val 2205267195 ecr 870503584], length 36
2023-07-13 20:46:36.538208 IP 10.10.200.9.55322 > 10.10.200.2.22: Flags [.], ack 11780, win 8735, options [nop,nop,TS val 870503585 ecr 2205267195], length 0
2023-07-13 20:46:36.538858 IP 10.10.200.2.22 > 10.10.200.9.55322: Flags [P.], seq 11780:11880, ack 37, win 503, options [nop,nop,TS val 2205267196 ecr 870503585], length 100
2023-07-13 20:46:36.539231 IP 10.10.200.2.22 > 10.10.200.9.55322: Flags [P.], seq 11880:11932, ack 37, win 503, options [nop,nop,TS val 2205267197 ecr 870503585], length 52
2023-07-13 20:46:36.539285 IP 10.10.200.2.22 > 10.10.200.9.55322: Flags [P.], seq 11932:11968, ack 37, win 503, options [nop,nop,TS val 2205267197 ecr 870503585], length 36
2023-07-13 20:46:36.539608 IP 10.10.200.9.55322 > 10.10.200.2.22: Flags [.], ack 11968, win 8735, options [nop,nop,TS val 870503586 ecr 2205267196], length 0
2023-07-13 20:46:36.541454 IP 10.10.200.2.22 > 10.10.200.9.55322: Flags [P.], seq 11968:12092, ack 37, win 503, options [nop,nop,TS val 2205267199 ecr 870503586], length 124
2023-07-13 20:46:36.541520 IP 10.10.200.2.22 > 10.10.200.9.55322: Flags [P.], seq 12092:12128, ack 37, win 503, options [nop,nop,TS val 2205267199 ecr 870503586], length 36
2023-07-13 20:46:36.541830 IP 10.10.200.2.22 > 10.10.200.9.55322: Flags [P.], seq 12128:12244, ack 37, win 503, options [nop,nop,TS val 2205267199 ecr 870503586], length 116
2023-07-13 20:46:36.542122 IP 10.10.200.9.55322 > 10.10.200.2.22: Flags [.], ack 12128, win 8735, options [nop,nop,TS val 870503589 ecr 2205267199], length 0
2023-07-13 20:46:36.542336 IP 10.10.200.2.22 > 10.10.200.9.55322: Flags [P.], seq 12244:12296, ack 37, win 503, options [nop,nop,TS val 2205267200 ecr 870503589], length 52
2023-07-13 20:46:36.542391 IP 10.10.200.2.22 > 10.10.200.9.55322: Flags [P.], seq 12296:12332, ack 37, win 503, options [nop,nop,TS val 2205267200 ecr 870503589], length 36
2023-07-13 20:46:36.542836 IP 10.10.200.9.55322 > 10.10.200.2.22: Flags [.], ack 12332, win 8735, options [nop,nop,TS val 870503590 ecr 2205267199], length 0
2023-07-13 20:46:36.543422 IP 10.10.200.2.22 > 10.10.200.9.55322: Flags [P.], seq 12332:12432, ack 37, win 503, options [nop,nop,TS val 2205267201 ecr 870503590], length 100
2023-07-13 20:46:36.543822 IP 10.10.200.2.22 > 10.10.200.9.55322: Flags [P.], seq 12432:12484, ack 37, win 503, options [nop,nop,TS val 2205267201 ecr 870503590], length 52
2023-07-13 20:46:36.543877 IP 10.10.200.2.22 > 10.10.200.9.55322: Flags [P.], seq 12484:12520, ack 37, win 503, options [nop,nop,TS val 2205267201 ecr 870503590], length 36
2023-07-13 20:46:36.544264 IP 10.10.200.9.55322 > 10.10.200.2.22: Flags [.], ack 12520, win 8735, options [nop,nop,TS val 870503591 ecr 2205267201], length 0
2023-07-13 20:46:36.545986 IP 10.10.200.2.22 > 10.10.200.9.55322: Flags [P.], seq 12520:12644, ack 37, win 503, options [nop,nop,TS val 2205267203 ecr 870503591], length 124
2023-07-13 20:46:36.546053 IP 10.10.200.2.22 > 10.10.200.9.55322: Flags [P.], seq 12644:12680, ack 37, win 503, options [nop,nop,TS val 2205267204 ecr 870503591], length 36
2023-07-13 20:46:36.546317 IP 10.10.200.2.22 > 10.10.200.9.55322: Flags [P.], seq 12680:12796, ack 37, win 503, options [nop,nop,TS val 2205267204 ecr 870503591], length 116
2023-07-13 20:46:36.546385 IP 10.10.200.2.22 > 10.10.200.9.55322: Flags [P.], seq 12796:12832, ack 37, win 503, options [nop,nop,TS val 2205267204 ecr 870503591], length 36
2023-07-13 20:46:36.546636 IP 10.10.200.9.55322 > 10.10.200.2.22: Flags [.], ack 12680, win 8735, options [nop,nop,TS val 870503593 ecr 2205267203], length 0
2023-07-13 20:46:36.546682 IP 10.10.200.9.55322 > 10.10.200.2.22: Flags [.], ack 12832, win 8735, options [nop,nop,TS val 870503594 ecr 2205267204], length 0
2023-07-13 20:46:36.547196 IP 10.10.200.2.22 > 10.10.200.9.55322: Flags [P.], seq 12832:12884, ack 37, win 503, options [nop,nop,TS val 2205267205 ecr 870503594], length 52
2023-07-13 20:46:36.547240 IP 10.10.200.2.22 > 10.10.200.9.55322: Flags [P.], seq 12884:12984, ack 37, win 503, options [nop,nop,TS val 2205267205 ecr 870503594], length 100
2023-07-13 20:46:36.547720 IP 10.10.200.9.55322 > 10.10.200.2.22: Flags [.], ack 12984, win 8735, options [nop,nop,TS val 870503594 ecr 2205267205], length 0
2023-07-13 20:46:36.548166 IP 10.10.200.2.22 > 10.10.200.9.55322: Flags [P.], seq 12984:13044, ack 37, win 503, options [nop,nop,TS val 2205267206 ecr 870503594], length 60
2023-07-13 20:46:36.548226 IP 10.10.200.2.22 > 10.10.200.9.55322: Flags [P.], seq 13044:13144, ack 37, win 503, options [nop,nop,TS val 2205267206 ecr 870503594], length 100
2023-07-13 20:46:36.548725 IP 10.10.200.9.55322 > 10.10.200.2.22: Flags [.], ack 13144, win 8735, options [nop,nop,TS val 870503595 ecr 2205267206], length 0
2023-07-13 20:46:36.548760 IP 10.10.200.2.22 > 10.10.200.9.55322: Flags [P.], seq 13144:13196, ack 37, win 503, options [nop,nop,TS val 2205267206 ecr 870503594], length 52
2023-07-13 20:46:36.548839 IP 10.10.200.2.22 > 10.10.200.9.55322: Flags [P.], seq 13196:13232, ack 37, win 503, options [nop,nop,TS val 2205267206 ecr 870503595], length 36
2023-07-13 20:46:36.549328 IP 10.10.200.9.55322 > 10.10.200.2.22: Flags [.], ack 13232, win 8735, options [nop,nop,TS val 870503596 ecr 2205267206], length 0
2023-07-13 20:46:36.550467 IP 10.10.200.2.22 > 10.10.200.9.55322: Flags [P.], seq 13232:13452, ack 37, win 503, options [nop,nop,TS val 2205267208 ecr 870503596], length 220
2023-07-13 20:46:36.550506 IP 10.10.200.2.22 > 10.10.200.9.55322: Flags [P.], seq 13452:13656, ack 37, win 503, options [nop,nop,TS val 2205267208 ecr 870503596], length 204
2023-07-13 20:46:36.551066 IP 10.10.200.9.55322 > 10.10.200.2.22: Flags [.], ack 13656, win 8735, options [nop,nop,TS val 870503598 ecr 2205267208], length 0
2023-07-13 20:46:36.551253 IP 10.10.200.2.22 > 10.10.200.9.55322: Flags [P.], seq 13656:13708, ack 37, win 503, options [nop,nop,TS val 2205267209 ecr 870503598], length 52
2023-07-13 20:46:36.552242 IP 10.10.200.2.22 > 10.10.200.9.55322: Flags [P.], seq 13708:13976, ack 37, win 503, options [nop,nop,TS val 2205267210 ecr 870503598], length 268
2023-07-13 20:46:36.555300 IP 10.10.200.9.55322 > 10.10.200.2.22: Flags [.], ack 13976, win 8735, options [nop,nop,TS val 870503600 ecr 2205267209], length 0
2023-07-13 20:46:36.555496 IP 10.10.200.2.22 > 10.10.200.9.55322: Flags [P.], seq 13976:14484, ack 37, win 503, options [nop,nop,TS val 2205267213 ecr 870503600], length 508
2023-07-13 20:46:36.556225 IP 10.10.200.2.22 > 10.10.200.9.55322: Flags [P.], seq 14484:14584, ack 37, win 503, options [nop,nop,TS val 2205267214 ecr 870503600], length 100
2023-07-13 20:46:36.556739 IP 10.10.200.9.55322 > 10.10.200.2.22: Flags [.], ack 14584, win 8735, options [nop,nop,TS val 870503603 ecr 2205267213], length 0
2023-07-13 20:46:36.556878 IP 10.10.200.2.22 > 10.10.200.9.55322: Flags [P.], seq 14584:14644, ack 37, win 503, options [nop,nop,TS val 2205267214 ecr 870503603], length 60
2023-07-13 20:46:36.557346 IP 10.10.200.2.22 > 10.10.200.9.55322: Flags [P.], seq 14644:14768, ack 37, win 503, options [nop,nop,TS val 2205267215 ecr 870503603], length 124
